Category	Msg	Pattern
web-application-attack	ET EXPLOIT Possible CVE-2014-3704 Drupal SQLi attempt URLENCODE 19	"/(?:^|&|Content-Disposition[\x3a][^\n]*?name\s*?=\s*?[\x22\x27])\%6eam\%65\[[^\x5d]*?\W/i"
web-application-attack	ET EXPLOIT Possible CVE-2014-3704 Drupal SQLi attempt URLENCODE 20	"/(?:^|&|Content-Disposition[\x3a][^\n]*?name\s*?=\s*?[\x22\x27])\%6eam\%65\%5b[^\x5d]*?\W/i"
web-application-attack	ET EXPLOIT Possible CVE-2014-3704 Drupal SQLi attempt URLENCODE 21	"/(?:^|&|Content-Disposition[\x3a][^\n]*?name\s*?=\s*?[\x22\x27])\%6ea\%6de\[[^\x5d]*?\W/i"
web-application-attack	ET EXPLOIT Possible CVE-2014-3704 Drupal SQLi attempt URLENCODE 22	"/(?:^|&|Content-Disposition[\x3a][^\n]*?name\s*?=\s*?[\x22\x27])\%6ea\%6de\%5b[^\x5d]*?\W/i"
web-application-attack	ET EXPLOIT Possible CVE-2014-3704 Drupal SQLi attempt URLENCODE 23	"/(?:^|&|Content-Disposition[\x3a][^\n]*?name\s*?=\s*?[\x22\x27])\%6ea\%6d\%65\[[^\x5d]*?\W/i"
web-application-attack	ET EXPLOIT Possible CVE-2014-3704 Drupal SQLi attempt URLENCODE 24	"/(?:^|&|Content-Disposition[\x3a][^\n]*?name\s*?=\s*?[\x22\x27])\%6ea\%6d\%65\%5b[^\x5d]*?\W/i"
web-application-attack	ET EXPLOIT Possible CVE-2014-3704 Drupal SQLi attempt URLENCODE 25	"/(?:^|&|Content-Disposition[\x3a][^\n]*?name\s*?=\s*?[\x22\x27])\%6e\%61me\[[^\x5d]*?\W/i"
web-application-attack	ET EXPLOIT Possible CVE-2014-3704 Drupal SQLi attempt URLENCODE 26	"/(?:^|&|Content-Disposition[\x3a][^\n]*?name\s*?=\s*?[\x22\x27])\%6e\%61me\%5b[^\x5d]*?\W/i"
web-application-attack	ET EXPLOIT Possible CVE-2014-3704 Drupal SQLi attempt URLENCODE 27	"/(?:^|&|Content-Disposition[\x3a][^\n]*?name\s*?=\s*?[\x22\x27])\%6e\%61m\%65\[[^\x5d]*?\W/i"
web-application-attack	ET EXPLOIT Possible CVE-2014-3704 Drupal SQLi attempt URLENCODE 28	"/(?:^|&|Content-Disposition[\x3a][^\n]*?name\s*?=\s*?[\x22\x27])\%6e\%61m\%65\%5b[^\x5d]*?\W/i"
web-application-attack	ET EXPLOIT Possible CVE-2014-3704 Drupal SQLi attempt URLENCODE 29	"/(?:^|&|Content-Disposition[\x3a][^\n]*?name\s*?=\s*?[\x22\x27])\%6e\%61\%6de\[[^\x5d]*?\W/i"
web-application-attack	ET EXPLOIT Possible CVE-2014-3704 Drupal SQLi attempt URLENCODE 30	"/(?:^|&|Content-Disposition[\x3a][^\n]*?name\s*?=\s*?[\x22\x27])\%6e\%61\%6de\%5b[^\x5d]*?\W/i"
web-application-attack	ET EXPLOIT Possible CVE-2014-3704 Drupal SQLi attempt URLENCODE 31	"/(?:^|&|Content-Disposition[\x3a][^\n]*?name\s*?=\s*?[\x22\x27])\%6e\%61\%6d\%65\[[^\x5d]*?\W/i"
web-application-attack	ET EXPLOIT Possible CVE-2014-3704 Drupal SQLi attempt URLENCODE 32	"/(?:^|&|Content-Disposition[\x3a][^\n]*?name\s*?=\s*?[\x22\x27])\%6e\%61\%6d\%65\%5b[^\x5d]*?\W/i"
trojan-activity	ET MALWARE Win32/Zemot Requesting PE	"/^\/mod_jshoppi(?:-|ng|\/)/"
trojan-activity	ET MALWARE Orca RAT URI Struct 1	"/^\/[A-Za-z0-9+~]+(?:=[1-2])?\/[A-Za-z0-9+~]+(?:=[1-2])?\/[A-Za-z0-9+~]+(?:=[1-2])?\/[A-Za-z0-9+~]+(?:=[1-2])?\/[A-Za-z0-9+~]+(?:=[1-2])?$/"
trojan-activity	ET MALWARE Orca RAT URI Struct 1	"/(?: MSIE |rv\x3a11)/i"
trojan-activity	ET MALWARE CryptoBot Downloading Files	"/\/[a-z]+\.k(?:ey)?btc$/"
command-and-control	ET MALWARE Backoff Variant Checkin	"/&id=[A-F0-9]+$/"
exploit-kit	ET EXPLOIT_KIT Nuclear SilverLight URI Struct (noalert)	"/\/14\d{8}(?:\.xap)?$/"
targeted-activity	ET MALWARE Win32/Roficor.A (Darkhotel) Checkin 1	"/\/images\/view\.php$/"
targeted-activity	ET MALWARE Win32/Roficor.A (Darkhotel) Checkin 2	"/\/txt\/read\.php$/"
policy-violation	ET POLICY IP Check wtfismyip.com	"/^\/(?:text|json|xml)?$/"
trojan-activity	ET MALWARE CoinVault POST M1	"/^hwid=[A-F0-9]{4}(?:-[A-F0-9]{4}){7}&func=/"
command-and-control	ET MALWARE Win32/Urausy.C Checkin 2	"/\/[A-Za-z0-9-_]{75,}\.html$/"
command-and-control	ET MALWARE Trojan/W32.KRBanker.60928.C Checkin	"/filename=\x22[A-Z]\x3a\\.+?\\[a-f0-9]{32}\.zip\x22\r\n/"
trojan-activity	ET MALWARE HompesA Activity	"/^\/me\/(?:get(?:ref|ua)\.php|videos\.txt)$/"
command-and-control	ET MALWARE Trojan/MSIL.bfsx Checkin	"/\/infect(?:-\d)?\.php$/"
trojan-activity	ET MALWARE Vawtrak/NeverQuest Posting Data	"/&hash=[^&]+$/"
trojan-activity	ET MALWARE Cloud Atlas Request to WebDAV CloudMe	"/^\/(?:b(?:i(?:llder1405|mm4276)|rowner8674935)|c(?:arter0648|h(?:ak2488|hloe7400)|orn6814)|d(?:aw0996|epp3353)|fr(?:anko7046|ogs6352)|garristone|hurris4124867|james9611|lisa\.walker|parker2339915|sa(?:mantha2064|nmorinostar)|tem5842|young0498814)\/CloudDrive\//i"
trojan-activity	ET MALWARE Cloud Atlas Request to WebDAV CloudMe	"/^Host\x3a[^\r\n]+?webdav\.cloudme\.com[^\r\n]*?\r?$/mi"
command-and-control	ET MOBILE_MALWARE CoolReaper CnC Beacon 1	"/\/dmp\/api\/[a-z]+$/"
command-and-control	ET MOBILE_MALWARE CoolReaper CnC Beacon 1	"/^Host\x3a[^\r\n]+?dmp\.[^\r\n]+?\r?$/mi"
exploit-kit	ET EXPLOIT_KIT Evil Flash Redirector to RIG EK Dec 17 2014	"/\.swf\?myid=[a-zA-Z0-9]+$/"
trojan-activity	ET MALWARE Trojan.Nurjax Downloading PE	"/\.exe\?dummy=\d+$/"
command-and-control	ET MALWARE Kronos Checkin	"/^(?P<v1>.).{33}(?P=v1).{9}(?P<v2>.)(?:.{4}(?P=v2)){3}/s"
trojan-activity	ET MALWARE Steam Stealer	"/\.png$/"
bad-unknown	ET POLICY exploitpack.com tool checkin	"/^\/changelog\/(?:appversion|changelog|help)$/"
command-and-control	ET MALWARE W32/Adrom.Backdoor CnC Beacon	"/\x26enckey\x3D[A-F0-9]+$/"
web-application-attack	ET WEB_SERVER Heimdallbot Attack Tool Inbound	"/^User-Agent\x3a[^\r\n]*?Heimdallbot/mi"
web-application-attack	ET WEB_SPECIFIC_APPS WP Generic revslider Arbitrary File Download	"/^[^\r\n]*(?:%2(?:52e(?:%2(?:52e(?:%(?:c(?:0%af|1%9c)|(?:25)?2f)|5c|\/)|e(?:%(?:c(?:0%af|1%9c)|(?:25)?2f)|5c|\/))|\.(?:%(?:c(?:0%af|1%9c)|(?:25)?2f)|5c|\/))|e(?:%2(?:52e(?:%(?:c(?:0%af|1%9c)|(?:25)?2f)|5c|\/)|e(?:%(?:c(?:0%af|1%9c)|(?:25)?2f)|5c|\/))|\.(?:%(?:c(?:0%af|1%9c)|(?:25)?2f)|5c|\/)))|\.(?:%2(?:52e(?:%(?:c(?:0%af|1%9c)|(?:25)?2f)|5c|\/)|e(?:%(?:c(?:0%af|1%9c)|(?:25)?2f)|5c|\/))|\.(?:%(?:c(?:0%af|1%9c)|(?:25)?2f)|5c|\/)))/Rim"
command-and-control	ET MALWARE Unknown Mailer CnC Beacon	"/^\/action\.php\?action=get_(?:mails|red)$/"
web-application-attack	ET WEB_SPECIFIC_APPS Wordpress PingBack Possible GHOST attempt	"/^\s*?https?\x3a\/\//Rs"
web-application-attack	ET WEB_SPECIFIC_APPS Wordpress PingBack Possible GHOST attempt	"/^\d[\d\x2e]{255}/R"
trojan-activity	ET MALWARE MSIL/Agent.PYO Retrieving Update	"/\/data_updater\.dat$/"
trojan-activity	ET MALWARE MSIL/Agent.PYO Retrieving Update	"/^Host\x3a[^\r\n]+\r\n(?:\r\n)?$/"
trojan-activity	ET MALWARE MSIL/Agent.PYO Retrieving Config	"/\/data\.cfg$/"
trojan-activity	ET MALWARE f0xy Download	"/\/bn_versions\/\d+?\.exe$/"
external-ip-check	ET MALWARE Upatre External IP Check	"/^(?:Accept\x3a\x20text\/\*, application\/\*\r\n)?User-Agent\x3a[^\r\n\x3b\x28\x29]+\r\nHost\x3a[^\r\n]+checkip\.dyndns\.org\r\nCache-Control\x3a[^\r\n]+\r\n(?:\r\n)?$/"
trojan-activity	ET MALWARE Upatre Common URI Struct Feb 12 2015	"/\/(?:5[12]|6[0-3])\/0\/[A-Z]*$/"
targeted-activity	ET MALWARE Arid Viper APT Checkin 1	"/&user=\d+$/"
attempted-user	ET WEB_SPECIFIC_APPS Cacti Superlinks Plugin SQL Injection	"/[?&]id=\d*?[^\d]\d*?(?:&|$)/i"
attempted-admin	ET EXPLOIT D-Link and TRENDnet ncc2 Service Vulnerability (ping.ccp) 2015-1187	"/ping_addr=[\d.]*[^\d.]/"
trojan-activity	ET MALWARE Xunpf.A Retrieving DLL	"/\/web_[0-9A-F]{12}\.jpg$/"
trojan-activity	ET MALWARE Andromeda Downloading Module	"/^Mozilla(?:\/4\.0)?$/"
trojan-activity	ET MALWARE Tor Based Locker Page (Torrentlocker)	"/Host\x3a\x20[a-z0-9]{16}\.[^\r\n]*?(?:tor|onion)/mi"
exploit-kit	ET EXPLOIT_KIT Unknown Malicious Second Stage Download URI Struct M2 Feb 06 2015	"/\.php\?rnd=[0-9]{3,7}&id=[0-9A-F]{44,54}$/"
command-and-control	ET MALWARE Win32/Trapwot FakeAV Post Infection CnC Beacon	"/^\/(?:[^\x2f]+\/)?rp\?[a-z]=/"
command-and-control	ET MALWARE Onkods.A Downloader Checkin	"/^\/(?:[a-z]+\/)*?[a-z]+\.exe$/"
command-and-control	ET MALWARE Onkods.A Downloader Checkin	"/^User-Agent\x3a\x20(?=\d*[a-z])[a-z0-9]+\r\nHost\x3a[^\r\n]+\r\n(?:\r\n)?$/"
trojan-activity	ET MALWARE Banker Boleto Fraud JS_BROBAN.SM Known Domain (bagacaoutra.ru)	"/^Host\x3a[^\r\n]+bagacaoutra\.ru\r\n/mi"
trojan-activity	ET MALWARE Banker Boleto Fraud JS_BROBAN.SM Known Domain (bagacavoltou.ru)	"/^Host\x3a[^\r\n]+bagacavoltou\.ru/mi"
trojan-activity	ET MALWARE Banker Boleto Fraud JS_BROBAN.SM Known Domain (bagacaveia.ru)	"/^Host\x3a[^\r\n]+bagacaveia\.ru/mi"
command-and-control	ET MALWARE Win32/Trapwot FakeAV Checkin	"/^\/(?:[a-z]+\/)?[a-z_]+\?[a-z]=/"
command-and-control	ET MALWARE FakeAV Variant CnC Beacon	"/\.php\?id=\d+$/"
command-and-control	ET MALWARE Win32/Teslacrypt Ransomware HTTP CnC Beacon M1	"/\/state[^\x2f]*\.php\?[A-Za-z0-9+/]*={0,2}$/"
command-and-control	ET MALWARE Win32/Injector.BXEW Variant HTTP CnC Beacon 2	"/^Accept\x3a\x20\*\/\*,[^\r\n]+, MZ/mi"
trojan-activity	ET MALWARE Win32/Kelihos.F exe Download 2	"/^\/[^\x2f]+?\.exe$/i"
attempted-recon	ET SCAN Grendel-Scan Web Application Security Scan Detected	"/\x2Frandom\w+?\x2E(?:c(?:f[cm]|gi)|ht(?:ml?|r)|(?:ws|x)dl|a(?:sp|xd)|p(?:hp3|l)|bat|swf|vbs|do)/i"
command-and-control	ET MALWARE Operation Buhtrap CnC Beacon 1	"/\/gate\.php$/"
command-and-control	ET MALWARE CoinVault Mailer CnC Beacon	"/\/redirect\.php\?loc=mail$/"
command-and-control	ET MALWARE Sysget/HelloBridge HTTP GET CnC Beacon	"/&(?:uid|name|file)=[a-f0-9]+$/"
command-and-control	ET MALWARE Zacom/NFlog Checkin	"/\?HostID=([A-F0-9]{2}(?:-|<>)){5}[A-F0-9]{2}$/"
command-and-control	ET MALWARE PunkeyPOS HTTP CnC Beacon 5	"/\/\?bit=(?:32|64)&version=\d{4}-\d{1,2}-\d{1,2}$/"
command-and-control	ET MALWARE PunkeyPOS HTTP CnC Beacon 6	"/\/\?check$/"
trojan-activity	ET MALWARE Possible Graftor Downloading Dridex	"/^\/\d+\/\d+\.exe$/"
trojan-activity	ET MALWARE Possible Graftor Downloading Dridex	"/^Host\x3a[^\r\n]+\r\nAccept-Language\x3a[^\r\n]+\r\nAccept\x3a[^\r\n]+\r\nAccept-Encoding\x3a[^\r\n]+\r\nConnection\x3a\x20close\r\nUser-Agent\x3a[^\r\n]+\r\n(?:\r\n)?$/"
targeted-activity	ET MALWARE CozyDuke APT HTTP GET CnC Beacon	"/[A-Z]{100}(?:&\w+=[a-zA-Z0-9/+=]+){0,2}$/"
targeted-activity	ET MALWARE CozyDuke APT HTTP POST CnC Beacon	"/\.php\?$/"
targeted-activity	ET MALWARE CozyDuke APT HTTP POST CnC Beacon	"/^\w+=(?:[a-zA-Z0-9/+=]{1,30}&\w+=)?[a-zA-Z0-9+/]{0,13}[A-Z]{200}/"
targeted-activity	ET MALWARE BUILDINGCAN CnC Activity	"/(?:&(?:boardid|bbsNo|strBoardID|userid|bbs|filename|code|pid|seqNo|ReportID|v|PageNumber|num|view|read|action|page|mode|idx|cateId|bbsId|pType|pcode|index|tbl|idx_num|act|bbs_id|bbs_form|bid|bbscate|menu|tcode|b_code|bname|tb|borad01|borad02|borad03|mid|newsid|table|Board_seq|bc_idx|seq|ArticleID|B_Notice|nowPage|webid|boardDiv|sub_idxa)=[^&]+){3}$/R"
exploit-kit	ET EXPLOIT_KIT Possible Sundown EK Payload Struct T2 M1 Apr 24 2015	"/\/(?:Flash[23]?|Ink|New|One|HQ).exe$/"
command-and-control	ET MALWARE Downeks Checkin 2	"/\/setup\/[a-zA-Z0-9!-]{100,}$/"
trojan-activity	ET MALWARE BePush/Kilim payload retrieval	"/\/app\.exe$/"
exploit-kit	ET EXPLOIT_KIT Fiesta EK SilverLight Exploit Apr 23 2015	"/Content-Disposition\x3a\x20[^\r\n]+filename=[a-z]{5,8}\d{2,3}\.xap\r\n/m"
bad-unknown	ET INFO Dotted Quad Host M1 (noalert)	"/^1\d{0,2}\.\d{1,3}\.\d{1,3}\.\d{1,3}$/"
bad-unknown	ET INFO Dotted Quad Host M2 (noalert)	"/^2\d{0,2}\.\d{1,3}\.\d{1,3}\.\d{1,3}$/"
bad-unknown	ET INFO Dotted Quad Host M3 (noalert)	"/^3\d{0,2}\.\d{1,3}\.\d{1,3}\.\d{1,3}$/"
bad-unknown	ET INFO Dotted Quad Host M4 (noalert)	"/^4\d{0,2}\.\d{1,3}\.\d{1,3}\.\d{1,3}$/"
bad-unknown	ET INFO Dotted Quad Host M5 (noalert)	"/^5\d{0,2}\.\d{1,3}\.\d{1,3}\.\d{1,3}$/"
bad-unknown	ET INFO Dotted Quad Host M6 (noalert)	"/^6\d{0,2}\.\d{1,3}\.\d{1,3}\.\d{1,3}$/"
bad-unknown	ET INFO Dotted Quad Host M7 (noalert)	"/^7\d{0,2}\.\d{1,3}\.\d{1,3}\.\d{1,3}$/"
bad-unknown	ET INFO Dotted Quad Host M8 (noalert)	"/^8\d{0,2}\.\d{1,3}\.\d{1,3}\.\d{1,3}$/"
bad-unknown	ET INFO Dotted Quad Host M9 (noalert)	"/^9\d{0,2}\.\d{1,3}\.\d{1,3}\.\d{1,3}$/"
command-and-control	ET MALWARE Enfal CnC GET	"/^\/(?:tran|http)docs\//"
command-and-control	ET MALWARE Enfal CnC GET	"/^Host\x3a[^\r\n]+\r\n(?:Cache-Control|Pragma)\x3a\x20no-cache\r\n(?:\r\n)?$/mi"
trojan-activity	ET MALWARE Putty SSH Credential Stealer	"/=c3NoOi8v[A-Za-z0-9+/]+={0,2}$/"
command-and-control	ET MALWARE SPEAR CnC Beacon	"/\.asp\?(?:[A-Za-z0-9+*]{4})*(?:[A-Za-z0-9+*]{2}==|[A-Za-z0-9+*]{3}=|[A-Za-z0-9+*]{4})$/"
command-and-control	ET MALWARE SPEAR CnC Beacon 2	"/\?wd=(?:[A-Za-z0-9_-]{4})*(?:[A-Za-z0-9_-]{2}==|[A-Za-z0-9_-]{3}=|[A-Za-z0-9_-]{4})$/"
command-and-control	ET MALWARE JavaScriptBackdoor HTTP GET CnC Beacon	"/&version=\d+$/"
command-and-control	ET MALWARE H1N1 Loader CnC Beacon M1	"/^[A-Za-z0-9/_]+={0,2}$/"
trojan-activity	ET MALWARE Win32/Bancos URL Structure	"/\/[a-z]\/infects\/[a-z]\?[a-z]=[^\\\*\+\=\|\:\;\x22\?\<\>\,\#][a-zA-Z0-9-!@#\$%^&\(\)\x20_{}\.~]{1,14}/i"
command-and-control	ET MALWARE Win32/Zacom.A CnC Beacon 1	"/^\d{4}/"
trojan-activity	ET MALWARE Win32/Chinad Retrieving Config	"/^Host\x3a\x20(?:\d{1,3}\.){3}\d{1,3}\r\nCache-Control\x3a\x20no-cache\r\n(?:\r\n)?$/i"
trojan-activity	ET MALWARE W2KM_BARTALEX Downloading Payload	"/\/lns.txt$/"
exploit-kit	ET EXPLOIT_KIT KaiXin Secondary Landing Page	"/\/win\.html$/"
exploit-kit	ET EXPLOIT_KIT KaiXin Secondary Landing Page	"/Referer\x3a\x20http\x3a\x2f+(?P<refhost>[^\x3a\x2f\r\n]+)(?:\x3a\d{1,5})?[^\r\n]*?\/(?:index.html)?\r\n.*?\r\nHost\x3a\x20(?P=refhost)[\x3a\r]/si"
command-and-control	ET MALWARE Downloader.Win32.Adload (KaiXin Payload) Checkin	"/^\/[a-z]+?\.*?ini\?\d+$/i"
command-and-control	ET MALWARE Backdoor.Elise CnC Beacon 1 M1	"/\/[a-f0-9]{8}\/page_\d{8,10}\.html$/i"
command-and-control	ET MALWARE Matsnu Checkin	"/^[a-z]{1,7}=(?:[A-Za-z0-9+/]{4})*(?:[A-Za-z0-9+/]{2}==|[A-Za-z0-9+/]{3}=|[A-Za-z0-9+/]{4})$/"
attempted-admin	ET EXPLOIT AirLive RCI HTTP Request	"/\?write_(?:m(?:ac|sn)|hdv|pid|tan)&[^&]*\x3b/i"
trojan-activity	ET WEB_SERVER IIS ISN BackDoor Command Delete Log	"/[?&]isn_logdel/i"
trojan-activity	ET WEB_SERVER IIS ISN BackDoor Command Get Logpath	"/[?&]isn_logpath/i"
command-and-control	ET MALWARE Jiripbot CnC 2	"/Host\x3a\x20jdk\.[a-f0-9]{32}\.org/mi"
command-and-control	ET MALWARE Jiripbot CnC 2	"/SSID=[0-9]{5}[0-8][01][a-f0-9]{36}/m"
command-and-control	ET MALWARE Jiripbot CnC 1	"/^[a-f0-9]{32}\.org/R"
command-and-control	ET MALWARE Jiripbot CnC 1	"/SSID=[0-9]{5}[0-8][01][a-f0-9]{36}/"
command-and-control	ET MALWARE KINS/ZeusVM Variant CnC Beacon	"/\.php\/(?:[a-zA-Z0-9]+\/)+[A-F0-9]{8}$/"
command-and-control	ET MALWARE KINS/ZeusVM Variant CnC Beacon	"/^User-Agent\x3a[^\r\n]+(?: MSIE |rv\x3a11)/mi"
command-and-control	ET MALWARE KINS/ZeusVM Variant CnC Beacon	"/^[\x20-\x7e\s]{0,20}[^\x20-\x7e\s]/"
trojan-activity	ET MALWARE W2KM_BARTALEX Downloading Payload M2	"/^s?\x3a\x2f+[^\r\n\s]+\.exe/Ri"
exploit-kit	ET EXPLOIT_KIT DRIVEBY Possible Goon/Infinity/Magnitude EK SilverLight Exploit	"/\/\d{2,}\.xap$/i"
trojan-activity	ET WEB_CLIENT Possible Malicious Redirect 8x8 script tag URI struct	"/\/(?=[a-zA-Z\d]{0,6}[a-z][A-Z])[A-Za-z\d]{8}\.php\?id=\d{6,9}$/"
command-and-control	ET MALWARE Sakula/Mivast RAT CnC Beacon 7	"/\.jpg\?vid=\d+$/"
trojan-activity	ET MOBILE_MALWARE Android.Trojan.SLocker.DZ Checkin 2	"/^\/gac\/[a-f0-9]{15}$/"
command-and-control	ET MALWARE PlugX CnC Beacon	"/\?id=[a-f0-9]{8}$/"
command-and-control	ET MALWARE PlugX CnC Beacon	"/^[^\x3a]+\x3a\x20\d+\r\n[^\x3a]+\x3a\x20\d+\r\n[^\x3a]+\x3a\x20\d+\r\n[^\x3a]+\x3a\x20\d+\r\nUser-Agent\x3a/Ri"
command-and-control	ET MALWARE Vawtrak/NeverQuest CnC Beacon	"/\.php\?[a-z]+=0000[a-fA-F0-9]{4}&[a-z]+=\?[A-F0-9]+&[a-z]=\d{4}&[a-z]=\d{4}$/"
targeted-activity	ET MALWARE XDMonitor Sending Debug Messages	"/^[0-9a-f]+$/R"
command-and-control	ET MALWARE AlphaCrypt CnC Beacon 3	"/\/r\.php\?[A-F0-9]+=?$/"
command-and-control	ET MALWARE Win32/Aibatook checkin	"/^m=(?:[A-Za-z0-9+/]{4}){11}(?:(?:[A-Za-z0-9+/]{4}){6})?AA==/i"
trojan-activity	ET MOBILE_MALWARE Trojan.iPhoneOS.KeyRaider Checkin	"/&game=[a-f0-9]{40}$/"
exploit-kit	ET EXPLOIT_KIT Unknown Malicious Second Stage Download URI Struct Sept 15 2015	"/\.php\?rnd=\d+&id=[0-9A-F]{32,}$/"
command-and-control	ET MALWARE Ursnif Variant CnC Beacon 2	"/\/(?:[A-Za-z0-9+/]{4})*(?:[A-Za-z0-9+/\x20]{2}==|[A-Za-z0-9+/\x20]{3}=|[A-Za-z0-9+/\x20]{4})$/"
trojan-activity	ET MOBILE_MALWARE Android/Koler.C Checkin	"/&id=\d{15}$/"
command-and-control	ET MALWARE Ransomware Win32/WinPlock.A CnC Beacon 4	"/^\d+\x20/R"
trojan-activity	ET MOBILE_MALWARE YiSpecter Activity M2	"/^Host\x3a\x20[a-z0-9.]+\.bb800\.com/m"
trojan-activity	ET MOBILE_MALWARE YiSpecter Activity M1	"/\.plist$/"
command-and-control	ET MALWARE W32.Nemim Checkin	"/\.php\?a1=(?:[A-Za-z0-9+/]{4})*(?:[A-Za-z0-9+/]{2}==|[A-Za-z0-9+/]{3}=|[A-Za-z0-9+/]{4})&a2=[a-f0-9]{32}&a3=(?:[A-Za-z0-9+/]{4})*(?:[A-Za-z0-9+/]{2}==|[A-Za-z0-9+/]{3}=|[A-Za-z0-9+/]{4})$/i"
trojan-activity	ET MALWARE MWI Maldoc Load Payload	"/\/(?:im(?:age|g)|pict)\.(?:jpg|php)\?id=\d+&act=[12]$/"
trojan-activity	ET MALWARE MegalodonHTTP/LuciferHTTP Client Action	"/\.php\?hwid=[A-F0-9]{16}$/"
command-and-control	ET MALWARE Matryoshka CnC Beacon 1	"/^\/img\/[a-f0-9]{32}\/[a-f0-9]+\/general\.png$/"
web-application-attack	ET EXPLOIT Joomla RCE M2 (Serialized PHP in UA)	"/^User-Agent\x3a[^\r\n]*\bO\x3a\d+\x3a[^\r\n]*?\{[^\r\n]*?\}/mi"
web-application-attack	ET EXPLOIT Joomla RCE M3 (Serialized PHP in XFF)	"/^X-Forwarded-For\x3a[^\r\n]*\bO\x3a\d+\x3a[^\r\n]*?\{[^\r\n]*?\}/mi"
trojan-activity	ET MALWARE Possible Evil Macro Downloading Trojan Dec 16 2015 Post to EXE	"/^[\x2fa-z\d]+\.exe$/"
command-and-control	ET MALWARE Win32/Htbot.B Checkin	"/\.php\?command=(?:g(?:hl|et(?:ip|id|backconnect))|update2?|dl|log)(?:$|&)/"
trojan-activity	ET MALWARE Malicious VBS Downloader fake image zip	"/\.(?:gif|jpe?g)\.zip$/i"
command-and-control	ET MALWARE Linux/Torte Checkin	"/^(?:zh-CN|en-US)\x3b rv\x3a1\.7\.6\)\r\n/R"
successful-admin	ET WEB_SERVER WEBSHELL JSP/Backdoor Shell Access	"/\.war\?cmd=[a-zA-Z0-9+/=]+&winurl=[a-zA-Z0-9+/=]*&linurl=[a-zA-Z0-9+/=]*/"
exploit-kit	ET EXPLOIT_KIT Evil Redirector Leading to EK Feb 05 2016	"/\/\?keyword=(?:(?=[a-f]{0,31}[0-9])(?=[0-9]{0,31}[a-f])[a-f0-9]{32}|\d{5})$/"
command-and-control	ET MALWARE Win32/LockScreen CnC HTTP Pattern	"/(?:,0x[0-9a-f]{2}){10}$/"
command-and-control	ET MALWARE Putter Panda HTTPClient CnC HTTP Request	"/\/default\.aspx?\?tmp=(?:[A-Za-z0-9+/]{4})*(?:[A-Za-z0-9+/]{2}==|[A-Za-z0-9+/]{3}=|[A-Za-z0-9+/]{4})$/"
command-and-control	ET MALWARE Bedep HTTP POST CnC Beacon 2	"/^(?:Connection\x3a[^\r\n]+\r\n)?(?:Content-Type\x3a[^\r\n]+\r\n)?Accept\x3a[^\r\n]+\r\n(?:Accept-Encoding\x3a[^\r\n]+\r\n)?Accept-Language\x3a[^\r\n]+\r\n(?:Referer\x3a[^\r\n]+\.php[^\r\n]*?\r\n)?User-Agent\x3a[^\r\n]+(?: MSIE |rv\x3a11)/i"
command-and-control	ET MALWARE Bedep HTTP POST CnC Beacon 2	"/(?:[a-z]+=\d{3,4}\x3b\x20){4}/"
command-and-control	ET MALWARE Backdoor.Elise CnC Beacon 2	"/\/\d{8,10}\.html$/i"
command-and-control	ET MALWARE Win32/Backdoor.Dripion HTTP CnC Checkin	"/^\x40\x24[^\x20-\x7e\r\n]+$/s"
command-and-control	ET MALWARE Win32/Upgilf CnC Beacon	"/^\/[A-F0-9]+$/"
web-application-attack	ET WEB_SERVER ImageMagick CVE-2016-3718 SSRF Inbound (mvg + fill + url)	"/^\s*https?\x3a\/\//Ri"
web-application-attack	ET WEB_SERVER ImageMagick CVE-2016-3715 File Deletion Inbound (ephermeral:+ mvg)	"/^\s*\x3a\s*[./]/Ri"
web-application-attack	ET WEB_SERVER ImageMagick CVE-2016-3717 Local File Read Inbound (label: + mvg)	"/^\s*\x3a\s*\x40/Ri"
trojan-activity	ET MALWARE Xbagger Macro Encrypted DL	"/^\/[a-z0-9]+\.jpg\?(?=[a-z0-9]*[A-Z]+[a-z0-9])[A-Za-z0-9]+=\d{1,4}$/"
command-and-control	ET MALWARE Win32.Sality-GR Checkin 2	"/\.png\x3f[0-9a-f]{4,8}\x3d\d+?$/"
command-and-control	ET MALWARE Enfal CnC POST	"/^Host\x3a[^\r\n]+\r\nContent-Length\x3a\x20\d+\r\n(?:Cache-Control|Pragma)\x3a\x20no-cache\r\n(?:\r\n)?$/mi"
web-application-attack	ET WEB_SERVER ImageMagick CVE-2016-3714 Inbound (mvg)	"/https\x3a.+(?<!\x5c)(:[\x22\x27]|\\x2[27])\s*?[\x3b&\x7c><].*?(:[\x22\x27]|\\x2[27])/si"
web-application-attack	ET WEB_SERVER ImageMagick CVE-2016-3714 Inbound (svg)	"/xlink\s*?\x3a\s*?href\s*?=\s*?(:[\x22\x27]|\\x2[27])https.+?&quot\s*?\x3b(?:\x7c|&(?:[gl]t|amp)\s*?\x3b)/si"
trojan-activity	ET MALWARE Possible Malicious Macro DL EXE May 2016 (Mozilla compatible)	"/(?:\/(?:(?:p(?:lugins\/content\/vote\/\.ssl\/[a-z0-9]|a(?:nel\/includes\/[^\x2f]+|tric)|osts?\/[a-z0-9]+|rogcicicic)|s(?:ystem\/(?:logs|engine)\/[^\x2f]+?|e(?:rv(?:au|er)|ct)|gau\/.*?|alam|ucks|can|ke)|(?=[a-z]*[0-9])(?=[0-9]*[a-z])(?!setup\d+\.exe$)[a-z0-9]{5,10}|a(?:d(?:min\/images\/\w+|obe)|salam|live|us)|m(?:edia\/files\/\w+|a(?:cros?|rch)|soffice)|d(?:o(?:c(?:\/[a-z0-9]+)?|ne)|bust)|(?:~.+?\/\.[^\x2f]+|\.css)\/.+?|in(?:voice\/[^\x2f]+|fos?)|c(?:onfig|hris|alc)|u(?:swinz\w+|pdate)|xml\/load\/[^\x2f]+|(?:[Dd]ocumen|ve)t|Ozonecrytedserver|w(?:or[dk]|insys)|t(?:mp\/.+?|est)|fa(?:cture|soo)|n(?:otepad|ach)|k(?:be|ey|is)|ArfBtxz|office|yhaooo|[a-z]|etna|link|\d+)\.exe$|(?:(?=[a-z0-9]*?[3456789][a-z0-9]*?[3456789])(?=[a-z0-9]*?[h-z])[a-z0-9]{3,31}\+|PasswordRecovery|RemoveWAT|Dejdisc|Host\d+|Msword)\.exe)|(?:^\/(?:image\/.+?\/[^\x2f]+|x\/setup)|keem)\.exe$)/i"
targeted-activity	ET MALWARE APT28 SEDNIT Variant CnC Beacon 1	"/\.pdf\/\?[A-Za-z0-9]+=(?:[A-Za-z0-9+/]{4})*(?:[A-Za-z0-9+/]{2}==|[A-Za-z0-9+/]{3}=|[A-Za-z0-9+/]{4})$/"
targeted-activity	ET MALWARE APT28 SEDNIT Variant CnC Beacon 2	"/\.zip\/\?[A-Za-z0-9]+=(?:[A-Za-z0-9+/]{4})*(?:[A-Za-z0-9+/]{2}==|[A-Za-z0-9+/]{3}=|[A-Za-z0-9+/]{4})$/"
targeted-activity	ET MALWARE APT28 SEDNIT Variant CnC Beacon 3	"/\.htm\/\?[A-Za-z0-9]+=(?:[A-Za-z0-9+/]{4})*(?:[A-Za-z0-9+/]{2}==|[A-Za-z0-9+/]{3}=|[A-Za-z0-9+/]{4})$/"
targeted-activity	ET MALWARE APT28 SEDNIT Variant CnC Beacon 4	"/\.xml\/\?[A-Za-z0-9]+=(?:[A-Za-z0-9+/]{4})*(?:[A-Za-z0-9+/]{2}==|[A-Za-z0-9+/]{3}=|[A-Za-z0-9+/]{4})$/"
trojan-activity	ET MALWARE Xbagger Macro Encrypted DL Jun 13 2016	"/^\/[a-z0-9_-]+\.jpg\?[A-Za-z0-9]{2,10}=\d{1,4}$/"
targeted-activity	ET MALWARE Sednit Connectivity Check 0 Byte POST	"/\.[a-z]{3,4}\/\?[A-Za-z0-9]+=(?:[A-Za-z0-9+/]{4})*(?:[A-Za-z0-9+/]{2}==|[A-Za-z0-9+/]{3}=|[A-Za-z0-9+/]{4})$/"
targeted-activity	ET MALWARE Sednit Connectivity Check 0 Byte POST	"/^(?:www\.)?google(?:\.[a-z]{2,3})+$/"
trojan-activity	ET MALWARE SFG Client Information POST	"/\.log$/"
trojan-activity	ET MALWARE Possible Maldoc Downloading EXE Jul 26 2016	"/\/(?:[a-z0-9]+_){4,}[a-z0-9]+(?:\/[a-f0-9]+)*?\/[a-f0-9]+\.(?![Ee][Xx][Ee])[a-z0-9]+$/"
command-and-control	ET MALWARE Linux/Lady CnC Beacon 1	"/^\/pm\.sh\?\d+$/"
social-engineering	ET HUNTING Suspicious HTTP Refresh to SMS Aug 16 2016	"/^[^>]+url=sms\x3a/Rsi"
command-and-control	ET MALWARE Curso Banker.BR Checkin	"/\.asp\?m=(?:INS|UAC)(?:&p=&a=)?&i=201\d{11}&/i"
command-and-control	ET MALWARE PNScan.2 CnC Beacon 2	"/\?ver=\d+$/"
command-and-control	ET MALWARE PNScan.2 CnC Beacon	"/^\/(?:i686|arm|mips(?:el)?)\?ver=\d+$/"
command-and-control	ET MALWARE UsefulTyphon CnC Activity M1	"/&u=[a-f0-9]{16}&p=/"
command-and-control	ET MALWARE UsefulTyphon CnC Activity M2	"/\/[a-f0-9]{16}\.down$/"
trojan-activity	ET MALWARE Win32.Pony Variant FOX Reporting Adfraud Activity	"/\.php\/data$/"
trojan-activity	ET MALWARE Win32/Zemot URI Struct	"/\/catalog\/\d{3,}$/"
trojan-activity	ET MALWARE Anuna PHP Backdoor Attempt	"/\.php\?cookie=1$/"
command-and-control	ET MALWARE Citadel Checkin	"/^\/[A-Za-z0-9]+?\/file\.php$/"
trojan-activity	ET MALWARE Possible Malicious Tor Module Download	"/\/tor\/[^\x2f\x2e]+(?:32|64)\.dll$/i"
trojan-activity	ET MOBILE_MALWARE Android.Trojan.HiddenApp.OU Checkin 2	"/\/NotifyLog$/"
command-and-control	ET MALWARE DistTrack/Shamoon CnC Beacon M1	"/\.php\?shinu=(?:[A-Za-z0-9+/]{4})*(?:[A-Za-z0-9+/]{2}==|[A-Za-z0-9+/]{3}=|[A-Za-z0-9+/]{4})$/"
command-and-control	ET MALWARE Click Fraud Checkin	"/^\/link\.txt\?[0-9]{1,2}\x3a[0-9]{1,2}\x3a[0-9]{1,2}/"
command-and-control	ET MALWARE Win32/Braincrypt Ransomware CnC Checkin	"/\.php\?uuid=[a-z0-9]{32}$/i"
trojan-activity	ET MOBILE_MALWARE Android Fancy Bear Checkin	"/\/\?(?:text|from|a(?:gs|q)|oe|btnG|oprnd|utm|channel)=/"
command-and-control	ET MALWARE Win32/HydraCrypt CnC Beacon 3	"/^(?:Referer\x3a[^\r\n]+\r\n)?Host\x3a[^\r\n]+[\r\n]+$/"
exploit-kit	ET EXPLOIT_KIT RIG EK URI struct Oct 24 2016  (RIG-v)	"/^\/(?=.*?[&?][a-z]{2}_[a-z]{2}=\d+(?:&|$))(?=.*?[&?]q=(?:[A-Za-z0-9_-]{4})*(?:[A-Za-z0-9_-]{2}|[A-Za-z0-9_-]{3})+(?:&|$))(?=.*?[&?]oq=(?:[A-Za-z0-9_-]{4})*(?:[A-Za-z0-9_-]{2}|[A-Za-z0-9_-]{3})+(?:&|$)).*?[&?][a-z]{3}=[A-Za-z_]{3,20}(?=[a-z\d]*\x2e)(?=[a-z\x2e]*\d)[a-z\d\x2e]+(?:&|$)/"
trojan-activity	ET MALWARE Maldoc Second Stage VBS Downloader with URL Padding	"/\.exe\?+$/i"
social-engineering	ET EXPLOIT_KIT EITest SocEng Inject Jan 15 2017 EXE Download	"/^Content-Disposition\x3a[^\r\n]+filename\s*=\s*[\x22\x27]?Font_Update\.exe/mi"
trojan-activity	ET HUNTING SUSPICIOUS Possible Evil Download wsf Double Ext No Referer	"/\/[^\x2f]+\.[^\x2f]+\.wsf$/i"
trojan-activity	ET MALWARE Malicious JS.Nemucod to PS Dropping PE Nov 14 M2	"/^\/\w+\.php\?f=[a-z]?\d{1,3}(?:\.(?:dat|gif))?$/"
command-and-control	ET MOBILE_MALWARE Trojan-Spy.AndroidOS.Femas.b CnC Beacon	"/^d(?:id|ei)=[A-F0-9]{10,100}&method=IS[A-Z]{1,10}$/"
targeted-activity	ET MALWARE APT28 Uploader Variant Fake Request to Google	"/\/\?[a-zA-Z0-9]{1,3}=(?:[A-Za-z0-9+/]{4})*(?:[A-Za-z0-9+/]{2}==|[A-Za-z0-9+/]{3}=|[A-Za-z0-9+/]{4})$/"
trojan-activity	ET MOBILE_MALWARE iOS DualToy Checkin	"/&data=(?:([A-Za-z0-9]|%2[FB]){4})*(?:([A-Za-z0-9]|%2[FB]){2}==|([A-Za-z0-9]|%2[FB]){3}=|([A-Za-z0-9]|%2[FB]){4})$/"
command-and-control	ET MALWARE W32/KeyLogger.ACQH!tr Checkin	"/\.php\?cn(ame)?=/"
command-and-control	ET MALWARE Mutter Backdoor Checkin	"/^(Host\x3a [^\r\n]+?\r\nConnection\x3a Keep-Alive|Connection\x3a Keep-Alive\r\nHost\x3a [^\r\n]+?)\r\n(\r\n)?$/i"
exploit-kit	ET EXPLOIT_KIT Terror EK Payload RC4 Key M1 Mar 14 2017	"/^\s*[\x22\x27]\s*http[^\x22\x27]+\.php\s*[\x22\x27]\s*\x2c\s*[\x22\x27]\s*uylzJB3mWrFjellI9iDFGQjO/Rs"
trojan-activity	ET MALWARE MagikPOS Downloader Retrieving Payload	"/\.php\?file=(?:64|86)$/"
command-and-control	ET MALWARE MagikPOS CnC Beacon	"/\/api\/\?act=in$/"
