Category	Msg	Pattern
bad-unknown	ET DELETED Suspicious executable download possible Fast Flux Rogue Antivirus RunAV	"/RunAV_\d{3,4}\.exe/Ui"
bad-unknown	ET MALWARE Suspicious executable download adobe-flash.v	"/adobe-flash\.v\.\d{5}\.exe/Ui"
bad-unknown	ET DELETED Suspicious executable download possible Rogue AV (installer.xxxx.exe)	"/installer\.\d{4}\.exe/Ui"
trojan-activity	ET MALWARE Suspicious invoice.scr Download Request	"/\x2Finvoice\x2Escr$/Ui"
command-and-control	ET MALWARE MUROFET/Licat Trojan Checkin Forum	"/forum\/\?[0-9a-f]{8}$/U"
trojan-activity	ET MALWARE UPS Inbound bad attachment v.5	"/ups(_parcel_delivery-tracking-notice-|-Delivery-Notification-Message_)\S*\.zip/Ui"
misc-activity	ET MALWARE HTTP Request to a Malware Related Numerical .cn Domain	"/Host\x3A\x20[^a-z]*[0-9]{4,30}\x2Ecn\x0D\x0A/Hi"
command-and-control	ET MALWARE Trojan-GameThief.Win32.OnLineGames.bnye Checkin	"/User-Agent\x3a\x20[a-z]{3,4}\x0d\x0a/H"
trojan-activity	ET MALWARE Possible TDSS Trojan GET with xxxx_ string	"/\/xxxx_\d+\//U"
trojan-activity	ET WEB_CLIENT Nuclear landing with obfuscated plugindetect Apr 29 2013	"/(?P<e>\d{2})(?P<t>(?!(?P=e))\d{2})(?P=e)\d{2}(?P=t)\d{6}(?P=e)\d{12}(?P<q>(?!((?P=e)|(?P=t)))\d{2})\d{2}(?P<dot>(?!((?P=e)|(?P=t)|(?P=q)))\d{2})\d{2}(?P=dot)\d{2}(?P=q)/R"
trojan-activity	ET DELETED ZeuS estatements mailing campaign landing page	"/\/stetement_id\.\d+\//U"
bad-unknown	ET DELETED TDS Trojan Stream request /stream?	"/^\/stream\?\d$/U"
bad-unknown	ET INFO Googlebot User-Agent Outbound (likely malicious)	"/^User-Agent\x3a[^\r\n]*?Googlebot/Hmi"
bad-unknown	ET MALWARE HTTP Request to RunForestRun DGA Domain 16-alpha.waw.pl	"/^Host\x3a\s[^\r\n]+?\.[abedgfihkmlonqpsruwvyxz]{16}\.waw\.pl\r$/Hmi"
bad-unknown	ET MALWARE DNS Query to RunForestRun DGA Domain 16-alpha.waw.pl	"/\x10[abedgfihkmlonqpsruwvyxz]{16}\x03waw\x02pl\x00/i"
exploit-kit	ET EXPLOIT_KIT Malvertising Leading to EK Aug 19 2014 M4	"/^\s*?[\x22\x27](?P<var>[^\x22\x27]+)[\x22\x27]\s*?\x29\s*?==\s*?-1\x29\x7b[^\r\n]*?document\.cookie\s*?=\s*?[\x22\x27](?P=var)\s*?\x3d\s*?[^\r\n]+?[\r\n]*?$/Rsi"
exploit-kit	ET EXPLOIT_KIT Malvertising Leading to EK Aug 19 2014 M4	"/^\s*?[\x3a\x3d]\s*?[\x22\x27]?\-/Rsi"
exploit-kit	ET EXPLOIT_KIT Nuclear EK Payload URI Struct Nov 05 2013	"/^\/f(?:\/[^\x2f]+)?\/14\d{8}(?:\/\d{9,10})?(?:\/\d)+(?:\/x[a-f0-9]+(?:\x3b\d)+?)?$/U"
exploit-kit	ET EXPLOIT_KIT Nuclear EK CVE-2013-2551 URI Struct Sept 17 2014	"/^\/[a-z0-9]+?(?:\/\d)?\/14\d{8}\.htm$/U"
exploit-kit	ET EXPLOIT_KIT Nuclear EK CVE-2013-2551 URI Struct Sept 17 2014	"/^Referer\x3a[^\r\n]+?\/[a-f0-9A-Z\_\-]{14,}\.html(?:\x3a\d{1,5})?\r$/Hm"
trojan-activity	ET MALWARE Infostealer.Banprox Proxy.pac Download 3	"/^[^\x3b]+\\x(?:[57][0-9a]|4[0-9a-f]|6[1-9a-f]|3[0-9])/Ri"
trojan-activity	ET MALWARE Infostealer.Banprox Proxy.pac Download 2	"/^(?P<q>[\x22\x27])(?:(?!(?P=q))[^\r\n\x2c])+?(?P=q)\s*?\+\s*?[\x22\x27][^\r\n\x2c]*?[cg][\x22\x27\+\s]*?[o][\x22\x27\+\s]*?[vm][\x22\x27\+\s]*?\.[\x22\x27\+\s]*?b[\x22\x27\+\s]*?r[\x22\x27\+\s]*?\x2c/m"
bad-unknown	ET DOS DNS Amplification Attack Outbound	"/^[^\x00]+?\x00/R"
trojan-activity	ET MALWARE Possible Zeus GameOver/FluBot Related DGA NXDOMAIN Responses	"/^..[\x0d-\x20][a-z]{13,32}(?:\x03(?:biz|com|net|org)|\x04info|\x02ru)\x00\x00\x01\x00\x01/Rs"
trojan-activity	ET MALWARE Linux/AES.DDoS Sending Real/Fake CPU&BW Info	"/^\d/R"
command-and-control	ET MALWARE Backdoor.Win32.PcClient.bal CnC (OUTBOUND) 3	"/[^\x33][^\x6f\x19\x18\x0e\x4f\x09\x08\x11\x0c\x0f\x0d\x1f\x10\x39][\x00-\x07\x0b\x0a\x1e\x1d\x12\x13\x15\x10\x1b\x1a\x54-\x5f\x50-\x52\x40-\x4b\x4d\x4e\x70-\x7f\x60-\x67\x69-\x6d]{1,14}\x33/R"
exploit-kit	ET EXPLOIT_KIT Sweet Orange Landing Page Dec 09 2013	"/^(?P<sep>.{1,50})u(?P=sep)n(?P=sep)c(?P=sep)t(?P=sep)i(?P=sep)o(?P=sep)n(?P=sep)\s/R"
command-and-control	ET MALWARE Linux/Yangji.A Checkin	"/^\x2d?\d/R"
exploit-kit	ET EXPLOIT_KIT DRIVEBY Nuclear EK Landing Aug 27 2014	"/^[a-f0-9]{6}\x22>\r\n(?:<(?P<tag>[^>]{1,10})>[A-Za-z0-9]+?<\/(?P=tag)>\r\n){0,10}(?:\r\n)*?<script>[^\r\n]+?\We[\x22\x27\+]*?v[\x22\x27\+]*?a[\x22\x27\+]*?l\W/R"
bad-unknown	ET ATTACK_RESPONSE Output of id command from HTTP server	"/^\d+[^\r\n\s]+/R"
trojan-activity	ET MALWARE Linux/ShellshockCampaign.DDOSBot Reporting IP	"/My\x20IP\x3A\x20\d{1,3}\x2E\d{1,3}\x2E\d{1,3}\x2E\d{1,3}\x0A/"
trojan-activity	ET WEB_CLIENT Upatre redirector GET Sept 29 2014	"/^\d+&w=\d+&ua=.+&e=1$/UR"
trojan-activity	ET MALWARE Likely Bot Nick in IRC (Country Code ISO 3166-1 alpha-2)	"/^[^\r\n]{0,7}\b(?:M[ACDEFGHKLMNOPQRSTUVWXYZ]|B[ABDEFGHIJLMNOQRSTVWYZ]|S[ABCDEGHIJKLMNORSTVXYZ]|C[ACDFGHIKLMNORUVWXYZ]|G[ABDEFGHILMNPQRSTUWY]|A[DEFGILMOQRSTUWXZ]|T[CDFGHJKLMNORTVWZ]|P[AEFGHKLMNRSTWY]|N[ACEFGILOPRUZ]|K[EGHIMNPRWYZ]|L[ABCIKRSTUVY]|I[DELMNOQRST]|E[CEGHRST]|V[ACEGINU]|D[EJKMOZ]|F[IJKMOR]|H[KMNRTU]|U[AGMSYZ]|R[EOSUW]|J[EMOP]|Z[AMW]|W[FS]|Y[ET]|OM|QA)\b/R"
trojan-activity	ET MALWARE Likely Bot Nick in IRC (Country Code ISO 3166-1 alpha-3)	"/^[^\r\n]{0,7}\b(?:M(?:A[CFR]|D[AGV]|N[EGP]|L[IT]|Y[ST]|[MS]R|CO|EX|HL|KD|OZ|RT|TQ|US|WI)|S(?:L[BEV]|[DEH]N|[JOP]M|G[PS]|V[KN]|W[EZ]|Y[CR]|[MU]R|AU|RB|SD|TP)|B(?:L[MRZ]|R[ABN]|E[LN]|G[DR]|H[RS]|[FW]A|DI|IH|MU|OL|TN|VT)|C(?:O[DGKLM]|H[ELN]|A[FN]|Y[MP]|[IP]V|[MX]R|CK|RI|UB|ZE)|A(?:R[EGM]|T[AFG]|L[AB]|N[DT]|U[ST]|BW|FG|GO|IA|SM|ZE)|G(?:R[CDL]|U[FMY]|I[BN]|N[BQ]|[AM]B|BR|EO|GY|HA|LP|TM)|T(?:U[NRV]|C[AD]|K[LM]|[GT]O|[HZ]A|[OW]N|JK|LS)|P(?:R[IKTY]|A[KN]|[HO]L|CN|ER|LW|NG|SE|YF)|N(?:[CPZ]L|I[CU]|[EO]R|AM|FK|GA|LD|RU)|L(?:B[NRY]|[CKV]A|[AS]O|IE|TU|UX)|I(?:R[LNQ]|S[LR]|[DM]N|ND|OT|TA)|K(?:[AG]Z|[IO]R|EN|HM|NA|WT)|E(?:S[HPT]|CU|GY|RI|TH)|V(?:[ACU]T|EN|GB|IR|NM)|D(?:[MZ]A|EU|JI|NK|OM)|F(?:R[AO]|IN|JI|LK|SM)|H(?:[MN]D|KG|RV|TI|UN)|U(?:[GS]A|KR|MI|RY|ZB)|J(?:AM|EY|OR|PN)|R(?:[EO]U|US|WA)|Z(?:AF|MB|WE)|W(?:LF|SM)|OMN|QAT|YEM)\b/R"
trojan-activity	ET DELETED Potential FakeAV HTTP POST Check-IN (?r=)	"/loads2\.php\?r=[0-9]{2}\.[0-9]/Ui"
trojan-activity	ET MALWARE Possible CryptoLocker TorComponent DL	"/^.\x00\x00\x00[a-z0-9]+?\x00/s"
command-and-control	ET DELETED Backdoor family PCRat/Gh0st CnC traffic (OUTBOUND) 42	"/^[\x20-\x7e]{5}.{4}\x7c\x01/s"
command-and-control	ET MALWARE Smoke Loader C2 Response	"/^\d+[\r\n]*?$/Rs"
targeted-activity	ET EXPLOIT_KIT DRIVEBY Generic CollectGarbage in JJEncode (Observed in Sednit)	"/^(?P<sep>.{1,20})\.___\+(?P=sep)\._\$\$\+(?P=sep)\._\$\+\(\!\[\]\+\x22\x22\)\[(?P=sep)\._\$_\]\+\(\!\[\]\+\x22\x22\)\[(?P=sep)\._\$_\]\+(?P=sep)\.\$\$\$_\+(?P=sep)\.\$\$__\+(?P=sep)\.__\+\x22\x5c\x5c\x22\+(?P=sep)\.__\$\+(?P=sep)\.___\+(?P=sep)\.\$\$\$\+(?P=sep)\.\$_\$_\+\x22\x5c\x5c\x22\+(?P=sep)\.__\$\+(?P=sep)\.\$\$_\+(?P=sep)\._\$_\+(?P=sep)\.\$_\$\$\+(?P=sep)\.\$_\$_\+\x22\x5c\x5c\x22\+(?P=sep)\.__\$\+(?P=sep)\.\$__\+(?P=sep)\.\$\$\$\+(?P=sep)\.\$\$\$_\+/R"
exploit-kit	ET DELETED Possible Sweet Orange Secondary Landing	"/(?:\/[a-z-]+)+\.php\?[a-z]+=[0-9]+[^\r\n]+HTTP\/1\.1/R"
command-and-control	ET DELETED W32/SpyClicker.ClickFraud Click CnC Beacon	"/&cid=\d+$/U"
policy-violation	ET POLICY gogo6/Freenet6 Authentication Attempt	"/^(?:ANONYMOUS|PASSDSS-3DES-1)\r\n/R"
attempted-admin	ET CURRENT_EVENTS Possible TWiki RCE attempt	"/debugenableplugins=[a-zA-Z0-9]+?\x3b/U"
misc-activity	ET HUNTING SUSPICIOUS SMTP Attachment Inbound PPT attachment with Embedded OLE Object M2	"/^[A-Za-z0-9\/\+\x0D\x0A]+?c[\x0d\x0a]{0,2}H[\x0d\x0a]{0,2}B[\x0d\x0a]{0,2}0[\x0d\x0a]{0,2}L[\x0d\x0a]{0,2}2[\x0d\x0a]{0,2}V[\x0d\x0a]{0,2}t[\x0d\x0a]{0,2}Y[\x0d\x0a]{0,2}m[\x0d\x0a]{0,2}V[\x0d\x0a]{0,2}k[\x0d\x0a]{0,2}Z[\x0d\x0a]{0,2}G[\x0d\x0a]{0,2}l[\x0d\x0a]{0,2}u[\x0d\x0a]{0,2}Z[\x0d\x0a]{0,2}3[\x0d\x0a]{0,2}M[\x0d\x0a]{0,2}v[\x0d\x0a]{0,2}b[\x0d\x0a]{0,2}2[\x0d\x0a]{0,2}x[\x0d\x0a]{0,2}l[\x0d\x0a]{0,2}T[\x0d\x0a]{0,2}2[\x0d\x0a]{0,2}J[\x0d\x0a]{0,2}q[\x0d\x0a]{0,2}Z[\x0d\x0a]{0,2}W[\x0d\x0a]{0,2}N[\x0d\x0a]{0,2}0/R"
misc-activity	ET HUNTING SUSPICIOUS SMTP Attachment Inbound PPT attachment with Embedded OLE Object M3	"/^[A-Za-z0-9\/\+\x0D\x0A]+?c[\x0d\x0a]{0,2}H[\x0d\x0a]{0,2}Q[\x0d\x0a]{0,2}v[\x0d\x0a]{0,2}Z[\x0d\x0a]{0,2}W[\x0d\x0a]{0,2}1[\x0d\x0a]{0,2}i[\x0d\x0a]{0,2}Z[\x0d\x0a]{0,2}W[\x0d\x0a]{0,2}R[\x0d\x0a]{0,2}k[\x0d\x0a]{0,2}a[\x0d\x0a]{0,2}W[\x0d\x0a]{0,2}5[\x0d\x0a]{0,2}n[\x0d\x0a]{0,2}c[\x0d\x0a]{0,2}y[\x0d\x0a]{0,2}9[\x0d\x0a]{0,2}v[\x0d\x0a]{0,2}b[\x0d\x0a]{0,2}G[\x0d\x0a]{0,2}V[\x0d\x0a]{0,2}P[\x0d\x0a]{0,2}Y[\x0d\x0a]{0,2}m[\x0d\x0a]{0,2}p[\x0d\x0a]{0,2}l[\x0d\x0a]{0,2}Y[\x0d\x0a]{0,2}3/R"
exploit-kit	ET WEB_CLIENT Possible Sweet Orange redirection Oct 8 2014	"/^\s*?(?P<var1>[^\x29\x5b]+)\x5b\s*?(?P<cntr>[^\x5d]+)\s*?\x5d\s*?\+\s*?(?P=var1)\x5b\s*?(?P=cntr)\s*?\+\s*?1\s*?\x5d\s*?\x29\s*?,\s*?16\s*?\x29\s*?\^\s*?parseInt\x28\x28\s*?(?P<var2>[^\x29\x5b]+)\x5b\s*?(?P=cntr)\s*?\x5d\s*?\+\s*?(?P=var2)\x5b\s*?(?P=cntr)\s*?\+\s*?1\s*?\x5d\s*?\x29\s*?,\s*16\s*?\x29\x29\s*?\x3b\s*?(?P=cntr)\s*?\+=\s*?2\s*?\x3b/Rs"
exploit-kit	ET EXPLOIT_KIT Archie EK CVE-2014-0515 Aug 24 2014	"/^\/(?:pruncd)?flashhigh\.swf$/U"
exploit-kit	ET EXPLOIT_KIT Archie EK CVE-2014-0497 Aug 24 2014	"/^\/(?:pruncd)?flashlow\.swf$/U"
exploit-kit	ET EXPLOIT_KIT Archie EK SilverLight URI Struct	"/^\/(?:pruncd)?silverapp1\.xap$/U"
exploit-kit	ET EXPLOIT_KIT Job314 EK URI Landing Struct	"/\?action=lnd$/U"
exploit-kit	ET EXPLOIT_KIT Job314 EK URI Exploit/Payload Struct	"/\?action=(?:pld|exp)&exp=/U"
trojan-activity	ET MALWARE Possible IRCBot.DDOS Common Commands	"/^[^\r\n]*?\x3a[^\r\n]*?(?:port(?:scan)?|udp[1-3]|tcp|http|download)[^\r\n]+?(?:\d{1,3}\x2E\d{1,3}\x2E\d{1,3}\x2E\d{1,3}|https?\x3A\x2F\x2F)/Ri"
trojan-activity	ET MALWARE Possible IRC Bot Common PRIVMSG Commands	"/^[^\r\n]*?(?:p[ao]rt|udp|c?tcp|http|d(?:ie|ownload)|mail|c?back|(?:msg|notice)?flood)/Ri"
exploit-kit	ET EXPLOIT_KIT Likely SweetOrange EK Flash Exploit URI Struct	"/\/(?=[a-z0-9]{0,10}[A-Z])(?=[A-Z0-9]{0,10}[a-z])[A-Z-a-z0-9]{5,11}$/U"
exploit-kit	ET EXPLOIT_KIT Likely SweetOrange EK Flash Exploit URI Struct	"/^Referer\x3a[^\r\n]+\x3a\d{1,5}\/[^\r\n]*?[a-z]+?\.php\?[a-z]+?=\d/Hm"
trojan-activity	ET WEB_CLIENT FlashPack Secondary Landing Oct 29	"/^(?!687474703a2f2f)(?P<h>[a-f0-9]{2})(?P<t>[a-f0-9]{2})(?P=t)(?P<p>[a-f0-9]{2})(?P<colon>[a-f0-9]{2})(?P<slash>[a-f0-9]{2})(?P=slash)/R"
exploit-kit	ET EXPLOIT_KIT Likely SweetOrange EK Java Exploit Struct (JNLP)	"/\/(?=[a-z]*?[A-Z])(?=[A-Z]*?[a-z])[A-Z-a-z]{18}\.jnlp$/U"
web-application-activity	GPL WEB_SERVER WEB-IIS Remote IIS Server Name spoof attempt loopback IP	"/http\x3A\/\/127\.0\.0\.1\/.*\.asp/i"
misc-attack	GPL VOIP EXPLOIT SIP UDP Softphone overflow attempt	"/^a\x3D[^\n]{1000,}/smi"
trojan-activity	ET MALWARE Possible Tinba DGA NXDOMAIN Responses (2)	"/^[a-z]{12}/R"
misc-activity	ET HUNTING SUSPICIOUS SMTP Attachment Inbound PPT attachment with Embedded OLE Object M1	"/^[A-Za-z0-9\/\+\x0D\x0A]+?B[\x0d\x0a]{0,2}w[\x0d\x0a]{0,2}d[\x0d\x0a]{0,2}C[\x0d\x0a]{0,2}9[\x0d\x0a]{0,2}l[\x0d\x0a]{0,2}b[\x0d\x0a]{0,2}W[\x0d\x0a]{0,2}J[\x0d\x0a]{0,2}l[\x0d\x0a]{0,2}Z[\x0d\x0a]{0,2}G[\x0d\x0a]{0,2}R[\x0d\x0a]{0,2}p[\x0d\x0a]{0,2}b[\x0d\x0a]{0,2}m[\x0d\x0a]{0,2}d[\x0d\x0a]{0,2}z[\x0d\x0a]{0,2}L[\x0d\x0a]{0,2}2[\x0d\x0a]{0,2}9[\x0d\x0a]{0,2}s[\x0d\x0a]{0,2}Z[\x0d\x0a]{0,2}U[\x0d\x0a]{0,2}9[\x0d\x0a]{0,2}i[\x0d\x0a]{0,2}a[\x0d\x0a]{0,2}m[\x0d\x0a]{0,2}V[\x0d\x0a]{0,2}j[\x0d\x0a]{0,2}d/R"
exploit-kit	ET EXPLOIT Fiesta Java Exploit/Payload URI Struct	"/\/\??[a-f0-9]{60,}(?:\x3b\d+){1,4}$/U"
exploit-kit	ET EXPLOIT Fiesta SilverLight 4.x Exploit URI Struct	"/\/\??[a-f0-9]{60,}\x3b4[0-1]\d{5}$/U"
trojan-activity	ET MALWARE Win32.TrojanProxy Configuration file Download	"/^(?:[A-Za-z0-9+/]{4})*(?:[A-Za-z0-9+/]{2}==|[A-Za-z0-9+/]{3}=|[A-Za-z0-9+/]{4})\x40\x24\x40$/Ri"
exploit-kit	ET EXPLOIT_KIT Sweet Orange CDN Gate Sept 09 2014 Method 2	"/\/k\?t[a-z]*=\d{5,}$/U"
exploit-kit	ET EXPLOIT_KIT Possible Sweet Orange redirection 19 September 2014	"/^\s*?=\s*?[\x22\x27](?!687474703a2f)[^\x22\x27]{0,10}6[^\x22\x27]{0,10}8[^\x22\x27]{0,10}7[^\x22\x27]{0,10}4[^\x22\x27]{0,10}7[^\x22\x27]{0,10}4[^\x22\x27]{0,10}7[^\x22\x27]{0,10}0[^\x22\x27]{0,10}3[^\x22\x27]{0,10}a[^\x22\x27]{0,10}2[^\x22\x27]{0,10}f/Ri"
trojan-activity	ET DELETED Possible Malicious Attachment With Double Extension Ending In EXE	"/^Content-Disposition\x3a\x20attachment\x3b\x20filename=[^\r\n]+?\.[a-z]{2,4}\.exe\r?$/Hmi"
exploit-kit	ET EXPLOIT_KIT Archie EK Exploit Flash URI Struct	"/^\/[^\x2f]*?flashhigh\.swf$/U"
exploit-kit	ET EXPLOIT_KIT Archie EK Exploit Flash URI Struct	"/^\/[^\x2f]*?flashlow\.swf$/U"
exploit-kit	ET EXPLOIT_KIT Archie EK Exploit IE URI Struct	"/^\/[^\x2f]*?iebasic\.html$/U"
attempted-user	ET ACTIVEX SoftArtisans XFile FileManager ActiveX Buildpath method stack overflow Attempt	"/<OBJECT\s+[^>]*classid\s*=\s*[\x22\x27]?\s*clsid\s*\x3a\s*\x7B?\s*E7B62F4E-82F4-11D2-BD41-00105A0A7E89/si"
attempted-user	ET ACTIVEX SoftArtisans XFile FileManager ActiveX stack overfow Function call Attempt	"/(Buildpath|GetDriveName|DriveExists|DeleteFile)/i"
exploit-kit	ET EXPLOIT_KIT Archie EK Exploit SilverLight URI Struct	"/^\/[^\x2f]*?silverapp1\.xap$/U"
exploit-kit	ET EXPLOIT_KIT Possible HanJuan EK Flash Payload DL	"/\/[a-z]{3,7}\.php$/U"
exploit-kit	ET EXPLOIT_KIT Possible HanJuan EK URI Struct Actor Specific	"/\/(?:[a-z0-9]{1,7}\.php)?\?zho=/U"
trojan-activity	ET EXPLOIT Possible HanJuan Flash Exploit	"/^\/(?:[a-z0-9]{3,7}\/)?[a-z]{3,7}\.swf$/U"
social-engineering	ET PHISHING Operation Huyao Landing Page Nov 07 2014	"/\/tslyphper(?:[A-Za-z0-9+/-_]{4})*(?:[A-Za-z0-9+/-_]{2}==|[A-Za-z0-9+/-_]{3}=|[A-Za-z0-9+/-_]{4})\.html$/U"
trojan-activity	ET MALWARE Possible Emotet DGA NXDOMAIN Responses	"/^[a-z]{16}/R"
trojan-activity	ET MALWARE Possible Dridex Campaign Download Nov 11 2014	"/\/get\/get\.php$/U"
trojan-activity	ET MALWARE Windows executable base64 encoded in XML	"/^[A-Za-z0-9\s/+]{100}/Rs"
command-and-control	ET MALWARE W32Autorun.worm.aaeh Checkin	"/^Host\x3a\x20ns1\.help(?:update(?:d\.(?:com?|net?|org?)|k\.(?:at?|eu?|tw)|r\.net|s\.com)|checks\.net)/mi"
exploit-kit	ET EXPLOIT_KIT NullHole EK Exploit URI Struct	"/^\/[a-f0-9]{32}\/(?=[a-z]*?[A-Z])(?=[A-Z]*?[a-z])[A-Za-z]+\.(?:html|jar|swf)$/U"
exploit-kit	ET EXPLOIT_KIT SPL2 EK Flash Exploit Nov 18 2014	"/^\/Drop2(?:-\d+)\.swf$/U"
exploit-kit	ET EXPLOIT_KIT SPL2 EK PluginDetect Data Hash Nov 18 2014	"/\/[a-z]+?-[a-z]+?-[a-z]+?\.html\?[a-z]+\d*?=[a-f0-9]{32}$/U"
exploit-kit	ET EXPLOIT_KIT SPL2 EK PluginDetect Data Hash Nov 18 2014	"/^[^\r\n]*?(?P<name>\/[^\.\/]+\.html)\?[a-z]+?\d*?=[a-f0-9]{32}\sHTTP\/1\..+?\r\nReferer\x3a\x20[^\r\n]*?(?P=name)(?:\d{1,5})?\r\n/Rs"
trojan-activity	ET CURRENT_EVENTS Possible FlashPack (FlashOnly) Payload Struct Nov 19 2014	"/^\/[a-z0-9]+\/load\.php$/U"
command-and-control	ET MALWARE Bamital Checkin Response 1	"/^<(?P<var1>[a-z])>[a-z0-9/]+<\/(?P=var1)><(?P<var2>[a-z])>[a-z0-9/]+<\/(?P=var2)>/Ri"
trojan-activity	ET EXPLOIT FlashPack Flash Exploit Nov 20 2014	"/^Referer\x3a[^\r\n]+\/gate.php\r$/Hm"
trojan-activity	ET DELETED SofosFO/NeoSploit possible second stage landing page (1)	"/^\/[a-z0-9A-Z]{15,35}\/((\d+[A-Z]){3}\d+|null)\//U"
exploit-kit	ET EXPLOIT_KIT Archie EK T2 Landing Struct Nov 20 2014	"/^\/[a-f0-9]{64}\.html$/U"
exploit-kit	ET EXPLOIT_KIT Archie EK T2 Landing Struct Nov 20 2014	"/^Host\x3a\s*?\d{1,3}\.\d{1,3}\.\d{1,3}\.\d{1,3}(?:\x3a|\r?\n)/Hmi"
exploit-kit	ET EXPLOIT_KIT Archie EK T2 PD Struct Nov 20 2014	"/^\/[a-f0-9]{64}\.js$/U"
exploit-kit	ET EXPLOIT_KIT Archie EK T2 PD Struct Nov 20 2014	"/^Referer\x3a[^\r\n]+\x3a\d{1,5}\/[a-f0-9]{64}\.html\r$/Hm"
exploit-kit	ET EXPLOIT_KIT Fiesta EK Landing Nov 05 2014	"/^(?:\x27\s*?\+\s*?\x27)?h(?:\x27\s*?\+\s*?\x27)?a(?:\x27\s*?\+\s*?\x27)?r(?:\x27\s*?\+\s*?\x27)?A(?:\x27\s*?\+\s*?\x27)?/R"
exploit-kit	ET EXPLOIT_KIT Fiesta EK Landing Nov 05 2014	"/^\s*?\x28\s*?[a-z0-9]{4,6}\s*?\x28\s*?[a-z0-9]{1,3}\s*?,\s*?[a-z0-9]{1,3}\s*?\x29\s*?\x29\s*?\x3b\s*?(?P<var>[a-z0-9]{1,3})\s*?\x3d\s*?\x28\s*?(?P=var)\s*?\x2b\s*?[a-z0-9]{1,3}\s*?\x29\s*?\x25\s*?[a-z0-9]{1,3}\.length\x3b/R"
exploit-kit	ET CURRENT_EVENTS Magnitude Flash Payload	"/^Host\x3a\x20\d{1,3}\.\d{1,3}.\d{1,3}.\d{1,3}(?:\x3a\d{1,5})?\r\n/H"
command-and-control	ET MALWARE Linux/ShellshockCampaign.DDOSBot Execute Shell Command CnC Server Message	"/^[^\r\n]+?\n$/R"
bad-unknown	ET WEB_CLIENT PDF With Hidden Embedded File	"/\x3C\x3C[^>]*\x2FEmbeddedfile/sm"
exploit-kit	ET EXPLOIT Magnitude Flash Exploit (IE)	"/^\/\??[a-f0-9]{32}(?:\/[a-f0-9]{32})?\/?$/U"
exploit-kit	ET EXPLOIT Magnitude Flash Exploit (IE)	"/Host\x3a\x20(?:\.*[a-f0-9]\.*){32}\./Hm"
command-and-control	ET MALWARE Linux/ShellshockCampaign.DDOSBot UDP Flood CnC Server Message	"/\x21\x20UDP\x20\d{1,3}\x2E\d{1,3}\x2E\d{1,3}\x2E\d{1,3}/"
command-and-control	ET MALWARE Linux/ShellshockCampaign.DDOSBot TCP Flood CnC Server Message	"/\x21\x20TCP\x20\d{1,3}\x2E\d{1,3}\x2E\d{1,3}\x2E\d{1,3}/"
command-and-control	ET MALWARE Linux/ShellshockCampaign.DDOSBot HOLD TCP Flood CnC Server Message	"/\x21\x20HOLD\x20\d{1,3}\x2E\d{1,3}\x2E\d{1,3}\x2E\d{1,3}/"
command-and-control	ET MALWARE Linux/ShellshockCampaign.DDOSBot Scanner CnC Server Message	"/\x21\x20SCANNER\x20(ON|OFF)\x0A/"
protocol-command-decode	ET POLICY Possible IPMI 2.0 RAKP Remote SHA1 Password Hash Retrieval RAKP message 1 with default BMC usernames (Admin|root|Administrator|USERID)	"/((\x0d|\x05)Admin(istrator)?|\x04root|\x06USERID)/Ri"
attempted-user	ET ACTIVEX J-Integra ActiveX SetIdentity Buffer Overflow	"/<object\s*[^>]*\s*classid\s*=\s*[\x22|\x27]\s*clsid\s*\x3a\s*{?\s*8234E54E-20CB-4A88-9AB6-7986F99BE243\s*}?\s*(.*)(\s|>)/si"
attempted-user	ET ACTIVEX J-Integra Remote Code Execution	"/<object\s*[^>]*\s*classid\s*=\s*(\x22|\x27)\s*clsid\s*\x3a\s*{?\s*F21507A7-530F-4A89-8FE4-9D989670FD2C\s*}?\s*(.*)(\s|)/si"
attempted-user	ET ACTIVEX J-Integra Remote Code Execution	"/\x2e[RemoveAccessPermission|AddLaunchPermission|AddAccessPermission|RemoveLaunchPermission]/"
attempted-user	ET ACTIVEX WMITools ActiveX Remote Code Execution	"/<object\s*[^>]*\s*classid\s*=\s*[\x22|\x27]\s*clsid\s*\x3a\s*{?\s*2745E5F5-D234-11D0-847A-00C04FD7BB08\s*}?(.*)\>/si"
command-and-control	ET MALWARE Linux/ShellshockCampaign.DDOSBot Random Byte Flood CnC Server Message	"/\x21\x20JUNK\x20\d{1,3}\x2E\d{1,3}\x2E\d{1,3}\x2E\d{1,3}/"
trojan-activity	ET MALWARE Possible Dyre DGA NXDOMAIN Responses (.cc)	"/^[a-z][a-f0-9]{33}/Ri"
exploit-kit	ET EXPLOIT_KIT Malicious Iframe Leading to EK Dec 08 2014	"/^[A-Za-z0-9]+\x27\s*?src=\x27http\x3a[^\x27]+[\x27]\s*width=1\d\s+height=1\d\s+/R"
exploit-kit	ET EXPLOIT_KIT Malicious Redirect Leading to EK Dec 08 2014	"/^Last-Modified\x3a\x20[^A-Za-z]{2}/Hm"
exploit-kit	ET EXPLOIT_KIT DRIVEBY Nuclear EK Payload (flowbits set)	"/^\/ABs[A-Za-z0-9_]+(?:\/x?[a-f0-9]+(?:\x3b\d+)+)?$/U"
exploit-kit	ET EXPLOIT_KIT DRIVEBY Nuclear EK Exploit Struct	"/^\/AwoVG[A-Za-z0-9_]+$/U"
trojan-activity	ET DELETED Bedep Checkin	"/^(?:[A-Za-z0-9+/]{4})*(?:[A-Za-z0-9+/]{2}==|[A-Za-z0-9+/]{3}=|[A-Za-z0-9+/]{4})$/P"
trojan-activity	ET DELETED Bedep Checkin	"/^Content-Length\x3a 2\d{2}\r?$/Hmi"
trojan-activity	ET DELETED Possible ASPROX Download URI Struct June 19 2014	"/\/[a-z]{2,9}\.php\?(?:[a-z0-9]{2,4}|[cktw])=[a-zA-Z0-9\x2b\x2f\x5c]{43,56}=?$/U"
trojan-activity	ET WEB_CLIENT Upatre Redirector Dec 16 2014 set	"/^\/[a-z]{10}\/[a-z]{10}\.html$/U"
trojan-activity	ET CURRENT_EVENTS SoakSoak Malware GET request	"/^Host\x3a[^\r\n]+soaksoak\.ru/Hmi"
trojan-activity	ET CURRENT_EVENTS SoakSoak Malware GET request	"/^\/xteas\/code$/U"
exploit-kit	ET EXPLOIT_KIT RIG EK Landing Page Sept 17 2014	"/^[a-z0-9]+\x2A\x2F\x22\x6F\x66\x74\x2E/R"
trojan-activity	ET DELETED IRC channel topic reptile commands	"/\.((testdlls|threads|netstatp|nsp|speed|uptime|installed|secure|sec|unsecure|unsec|process|ps|rand|exploitftpd|eftpd|flusharp|farp|flushdns|fdns|resolve|dns|pstore|pst|sysinfo|si|netinfo|ni|driveinfo|di|stats|currentip)\s*[\r\n]|(iestart|ies|login|l|mirccmd|system|file\s+(cat|exists|e|del|rm|rmdir|move|copy|attrib)|down|dl\x|update|reg\s+(query|delete|write))\s+\w+|(banner|ban|advscan|asc|scanall|sa|ntscan|nts)\s*[\n\r])/i"
exploit-kit	ET EXPLOIT_KIT Malicious Referer Bulk Traffic Sometimes Leading to EKs (Possible Bedep infection) Dec 16 2014	"/^Referer\x3a[^\r\n]+?rowedmedia\.com\/search\.php\r?$/Hmi"
trojan-activity	ET WEB_CLIENT Upatre Download Redirection Dec 18 2014	"/^[^\x2f\x22]+?\x22>/R"
exploit-kit	ET EXPLOIT_KIT Archie EK T2 Activity Dec 18 2014	"/^Host\x3a\s*?\d{1,3}\.\d{1,3}\.\d{1,3}\.\d{1,3}(?:\x3a|\r\n)/Hmi"
trojan-activity	ET MALWARE W32/Dridex Distribution Campaign Dec 19 2014	"/\/s?stat\/lldvs?\.php$/U"
trojan-activity	ET MALWARE W32/Dridex Distribution Campaign Dec 19 2014	"/^Host\x3A[^\r\n]+?\d{1,3}\x2E\d{1,3}\x2E\d{1,3}\x2E\d{1,3}(?:\x3a\d{1,5})?\r?$/Hmi"
targeted-activity	ET MALWARE Win32/Spy.Agent.OHT - AnunakAPT TCP Checkin 2	"/^[a-f0-9]+$/R"
trojan-activity	ET MALWARE Win32.Akdoor Reporting MAC Address	"/^[0-9A-F]{12}$/R"
trojan-activity	ET MALWARE Worm.Win32.Ngrbot.lof Join IRC channel	"/^\S{2,3}\x2d(XP|2K3|VIS|2K8|W7|ERR)\w?\x2d\w+?\x7D\w+?\r\n?/Ri"
trojan-activity	ET EXPLOIT Possible Misfortune Cookie - SET	"/^[0-9][^=]/R"
command-and-control	ET MALWARE Linux/DDoS.M distributed via CVE-2014-6271 Checkin	"/^(?:MIPS(?:EL)?|POWERPC|ARM|X86)\x0a$/R"
trojan-activity	ET MALWARE Linux/DDoS.M SCANNER command	"/^(?:ON|OFF)/R"
trojan-activity	ET DELETED Blackhole Landing Page Eval Variable Obfuscation 3	"/\x2B\x22l\x22(\x3B|\x5D)/"
trojan-activity	ET WEB_CLIENT Upatre Firefox/Chrome Redirector Receiving Payload Jan 9 2015	"/^\s*?\w+\s*?=\s*?[\x22\x27]UEsDB/R"
trojan-activity	ET DELETED Bedep Checkin Response	"/^(?:[A-Za-z0-9+/]{4})*(?:[A-Za-z0-9+/]{2}==|[A-Za-z0-9+/]{3}=|[A-Za-z0-9+/]{4})$/R"
command-and-control	ET MALWARE Linux/ChinaZ DDoS Bot Checkin	"/^\d+MHz\x00/R"
trojan-activity	ET MALWARE Scieron Retrieving Information Response	"/^(?:[A-Za-z0-9+/]{4})*(?:[A-Za-z0-9+/]{2}==|[A-Za-z0-9+/]{3}=|[A-Za-z0-9+/]{4})system$/R"
command-and-control	ET MALWARE W32/AGENT.NXNX Checkin 2	"/^\d{1,3}\.\d{1,3}\.\d{1,3}\.\d{1,3}D\x3a\x00+?$/"
trojan-activity	ET WEB_CLIENT Upatre Redirector Jan 23 2015	"/^\/js\/jquery-\d+\.\d{2}\.\d{2}\.js$/U"
trojan-activity	ET WEB_CLIENT Upatre Redirector Jan 23 2015	"/^[^\r\n]+?\.html?\r?$/Rmi"
trojan-activity	ET MALWARE Possible Mailer Dropped by Dyre SSL Cert	"/^.{2}(?P<var>[a-z0-9]{4,16}[01]).+?\x06\x03\x55\x04\x08.{2}(?P=var)/Rs"
exploit-kit	ET EXPLOIT_KIT DRIVEBY Nuclear EK Landing Jan 27 2015 M2	"/^[A-Za-z]{3,5}/R"
exploit-kit	ET EXPLOIT_KIT DRIVEBY Nuclear EK Landing Jan 27 2015 M2	"/^[a-zA-Z0-9]{9}<\/[^>]+>\s+?<[^\s]+\sid=\x22[a-zA-Z]{3,5}\x22\sstyle=\x22display\x3anone\x22>[A-Za-z0-9]{500}/Rs"
trojan-activity	ET MALWARE MSIL/Agent.PYO Receiving Config	"/^\d+\n/R"
trojan-activity	ET DELETED Flashpack Redirect Method 3	"/^Referer\x3a[^\r\n]+\.swf/Hmi"
trojan-activity	ET WEB_CLIENT HanJuan Landing Dec 10 2014	"/^[A-Za-z]{10,}/R"
trojan-activity	ET WEB_CLIENT HanJuan Landing Dec 10 2014	"/^[^\x27]*?2[^\x27]*?7[^\x27]*?c[^\x27]*?d[^\x27]*?b[^\x27]*?6[^\x27]*?e[^\x27]*?-[^\x27]*?a[^\x27]*?e[^\x27]*?6[^\x27]*?d[^\x27]*?-[^\x27]*?1[^\x27]*?1[^\x27]*?c[^\x27]*?f[^\x27]*?-[^\x27]*?9[^\x27]*?6[^\x27]*?b[^\x27]*?8[^\x27]*?-[^\x27]*?4[^\x27]*?4[^\x27]*?4[^\x27]*?5[^\x27]*?5[^\x27]*?3[^\x27]*?5[^\x27]*?4[^\x27]*?0[^\x27]*?0[^\x27]*?0[^\x27]*?0/Rsi"
command-and-control	ET DELETED Possible HTTP GET Deep Panda C2 Activity	"/\.jpg\?id=\d+$/U"
exploit-kit	ET WEB_CLIENT Sweet Orange Landing Nov 04 2013	"/^(?=[a-z]{0,7}[A-Z])(?=[A-Z]{0,7}[a-z])[A-Za-z]{8}\x22[^>]+?>[A-Za-z]{70}/Rs"
exploit-kit	ET DELETED Job314/Neutrino Reboot EK Payload Nov 20 2014	"/^\/(?:[a-z]+\.[a-z]+\d?\?(?:[a-z]+\x3d(?:[a-z]+|[0-9]+)&){3,}[a-z]+=(?:[a-z]+|[0-9]+)|(?:[a-z]+\x2f(?:[a-z]+|[0-9]+)\x2f){3,}[a-z]+\x2f(?:[a-z]+|[0-9]+)\x2f?)$/U"
command-and-control	ET MALWARE W32/AlienSpy RAT Checkin	"/^[\x53\x54]/R"
exploit-kit	ET DELETED Angler EK Payload DL M2 Feb 06 2015	"/^\/(?:[A-Za-z0-9-_]{4}){11,}(?:[A-Za-z0-9-_]{2}==|[A-Za-z0-9-_]{3}=)?$/U"
exploit-kit	ET EXPLOIT_KIT DRIVEBY Nuclear EK Landing Jan 27 2015 M1	"/^[a-z]{7}(?:\s*?[a-z]+\s*?)*?[a-z]{7,}\x2a\x2f[a-zA-Z]{3,5}\W/Rs"
exploit-kit	ET EXPLOIT_KIT DRIVEBY Nuclear EK Landing Jan 27 2015 M1	"/^[a-z]{7}(?:\s*?[a-z]+\s*?)*?[a-z]{7,}\x2a\x2f/Rs"
exploit-kit	ET EXPLOIT_KIT KaiXin EK Possible Jar Download	"/nb[\d+]=Yes/C"
exploit-kit	ET EXPLOIT_KIT KaiXin Landing Page M2	"/^(?P<vname>[A-Za-z0-9]+)\s*?=\s*?navigator.userAgent.toLowerCase\x28\x29\x3b.+?if\(document.cookie[^\r\n]+\([^\r\n]+(?P=vname)[\x2e\x5b\x22\x27+\s]+i[\x22\x27+\s]*n[\x22\x27+\s]*d[\x22\x27+\s]*e[\x22\x27+\s]*x[\x22\x27+\s]*O[\x22\x27+\s]*f[\x22\x27+\s]*\x5d?\(\s*?[\x22\x27]b[\x22\x27+\s]*o[\x22\x27+\s]*t[\x22\x27+\s]*[\x22\x27][^\r\n]+(?P=vname)[\x2e\x5b\x22\x27+\s]+i[\x22\x27+\s]*n[\x22\x27+\s]*d[\x22\x27+\s]*e[\x22\x27+\s]*x[\x22\x27+\s]*O[\x22\x27+\s]*f[\x22\x27+\s]*\x5d?\(\s*?[\x22\x27]s[\x22\x27+\s]*p[\x22\x27+\s]*i[\x22\x27+\s]*d[\x22\x27+\s]*e[\x22\x27+\s]*r[\x22\x27+\s]*[\x22\x27]/Rs"
web-application-attack	ET ATTACK_RESPONSE Microsoft SQL error in HTTP response, possible SQL injection point	"/^ SQL[-_ ]Server/R"
web-application-attack	ET ATTACK_RESPONSE Microsoft Access error in HTTP response, possible SQL injection point	"/^ \d+ Driver/R"
web-application-attack	ET ATTACK_RESPONSE Oracle error in HTTP response, possible SQL injection point	"/ORA-\d{4}/"
web-application-attack	ET ATTACK_RESPONSE Oracle error in HTTP response, possible SQL injection point	"/Warning.*\Woci_/m"
web-application-attack	ET ATTACK_RESPONSE Oracle error in HTTP response, possible SQL injection point	"/Warning.*\Wora_/m"
web-application-attack	ET ATTACK_RESPONSE DB2 error in HTTP response, possible SQL injection point	"/CLI Driver.*DB2/m"
web-application-attack	ET ATTACK_RESPONSE DB2 error in HTTP response, possible SQL injection point	"/bdb2_\w+\(/m"
web-application-attack	ET ATTACK_RESPONSE Informix error in HTTP response, possible SQL injection point	"/Exception.*Informix/m"
web-application-attack	ET ATTACK_RESPONSE SQLite error in HTTP response, possible SQL injection point	"/Warning.*SQLite3::/m"
