Category	Msg	Pattern
web-application-attack	ET WEB_SPECIFIC_APPS WordPress Facebook-Page-Promoter-Lightbox settings-updated Cross Site Scripting Attempt	"/^.+(?:script|onmouse[a-z]+|onkey[a-z]+|onload|onunload|ondragdrop|onblur|onfocus|onclick|ondblclick|onsubmit|onreset|onselect|onchange style\x3D)/Ri"
web-application-attack	ET WEB_SPECIFIC_APPS DokuWiki target parameter Cross-Site Scripting Attempt	"/^.+(?:s(?:cript|tyle\x3D)|on(?:mouse[a-z]|key[a-z]|load|unload|dragdrop|blur|focus|click|dblclick|submit|reset|select|change))/Ri"
trojan-activity	ET MALWARE BlackEnergy v2.x HTTP Request with Encrypted Variables	"/^[a-z]{3,6}\x3d[A-F0-9]{50}/i"
command-and-control	ET MALWARE Hitpop.AG/Pophot.az HTTP Checkin	"/^(?:[0-9A-F][0-9A-F]-){5}(?:[0-9A-F][0-9A-F])/Ri"
exploit-kit	ET EXPLOIT_KIT Sakura Exploit Kit Version 1.1 Archive Request	"/\x2Fgetfile\x2Ephp\x3Fi\x3D[0-9]\x26key\x3D[a-f0-9]{32}$/i"
web-application-attack	ET WEB_SPECIFIC_APPS Joomla com_jvb_bridge Itemid Parameter Remote File inclusion Attempt	"/^.*(?:ftps?|https?|php)\:\//Ri"
trojan-activity	ET MALWARE WindowsEnterpriseSuite FakeAV Reporting via POST	"/verint=\d+&uid=\d+&wv=[A-Za-z0-9]+&report=\d+&abbr=[A-Za-z0-9]+&pid=\d/"
command-and-control	ET MALWARE Yahoo550.com Related Downloader/Trojan Checkin	"/^\d+$/R"
web-application-attack	ET WEB_SPECIFIC_APPS WHCMS banco Parameter Remote File inclusion Attempt	"/^\s*(?:ftps?|https?|php)\:\//i"
trojan-activity	ET MALWARE Winquickupdates.com/Mycashloads.com Related Trojan Install Report	"/^(?:\d+|x.+)/R"
exploit-kit	ET EXPLOIT_KIT - Landing Page Requested - 15Alpha1Digit.php	"/^\/[a-z]{15}[0-9]\.php$/"
web-application-attack	ET WEB_SERVER possible IBM Rational Directory Server (RDS) Help system href Cross Site Scripting Attempt	"/^.+(?:script|alert|onmouse[a-z]+|onkey[a-z]+|onload|onunload|ondragdrop|onblur|onfocus|onclick|ondblclick|onsubmit|onreset|onselect|onchange|javascript)/Ri"
web-application-attack	ET WEB_SPECIFIC_APPS Concrete CMS approveImmediately parameter Cross-Site Scripting Attempt	"/^.+?(?:s(?:cript|tyle\x3D)|on(?:mouse[a-z]|key[a-z]|load|unload|dragdrop|blur|focus|click|dblclick|submit|reset|select|change|error))/Ri"
web-application-attack	ET WEB_SPECIFIC_APPS WordPress Count Per Day Plugin page parameter Cross-Site Scripting Attempt	"/^.+?(?:s(?:cript|tyle\x3D)|on(?:mouse[a-z]|key[a-z]|load|unload|dragdrop|blur|focus|click|dblclick|submit|reset|select|change))/Ri"
trojan-activity	ET MALWARE Kimsuky Related Host Data Exfil	"/^[a-z0-9]{12,14}(?:&p2=(?:[a-z0-9]([\._-])?){1,24}(?:_DROPPER)?)$/Ri"
web-application-attack	GPL EXPLOIT .cmd executable file parsing attack	"/^.*?\x26/Ri"
command-and-control	ET MALWARE Blackenergy Bot Checkin to C&C	"/id=x.+_[0-9A-F]{8}&build_id=./"
exploit-kit	ET EXPLOIT_KIT Likely TDS redirecting to exploit kit	"/^\d$/R"
command-and-control	ET MALWARE Mac Flashback Checkin 2	"/^[A-Za-z0-9+\/=]+?$/"
command-and-control	ET MALWARE Densmail.com Related Trojan Checkin	"/v=\d+&rnd=\d/i"
command-and-control	ET MALWARE Win32.Hupigon.dkwt Related Checkin	"/\?mac=[0-9]*?&os=[a-z]*?&ver=[0-9]{8}&id=/i"
trojan-activity	ET MALWARE Gamania Trojan Check-in	"/p4=\d+&p5=\d+&hs=\d/i"
trojan-activity	ET MALWARE Win32.Lager Trojan Reporting (gcu)	"/^\d/Ri"
trojan-activity	ET MALWARE Oficla Downloader Activity Observed	"/\x2Ephp\x3Fid\x3D\d*\x26v\x3D\d*\x26tm\x3D\d*\x26b\x3D/i"
trojan-activity	ET MALWARE Virut Counter/Check-in	"/\.asp\?mac=(?:[0-9A-F]{2}-){5}(?:[0-9A-F]{2})+&ver=\d/i"
web-application-attack	ET WEB_SPECIFIC_APPS Cyphor show.php SQL injection attempt	"/id=-?\d+\s+UNION\s/i"
web-application-attack	ET WEB_SPECIFIC_APPS Coppermine Photo Gallery output Parameter Remote Command Execution Attempt	"/output=\w/i"
web-application-attack	ET WEB_SPECIFIC_APPS Coppermine Photo Gallery retva Parameter Remote Command Execution Attempt	"/^\w/Ri"
trojan-activity	ET MALWARE Shylock Module Data POST	"/id=\d+&bid=[^&]+&query=\w+&data=\w/"
web-application-attack	ET WEB_SPECIFIC_APPS Plone and Zope cmd Parameter Remote Command Execution Attempt	"/cmd=\w/i"
exploit-kit	ET EXPLOIT_KIT Unknown Java Exploit Kit 32-32 byte hex initial landing	"/\/\?[a-f0-9]{32}=[^&]+&[a-f0-9]{32}=[^&]+$/"
exploit-kit	ET EXPLOIT_KIT Possible Glazunov Java payload request /5-digit	"/^\/\d{5}$/"
command-and-control	ET MALWARE Lyposit Ransomware Checkin 2	"/^[a-z]{1,4}\x3d[a-z0-9]+?$/Ri"
command-and-control	ET MALWARE WORM_VOBFUS Checkin 1	"/^\d{5}\x2eddns[a-z0-9]\x2eeu$/"
exploit-kit	ET EXPLOIT_KIT RedKit - Potential Payload Requested - /2Digit.html	"/\/[0-9]{2}\.html$/"
attempted-user	ET WEB_SPECIFIC_APPS Nagios XI Network Monitor - OS Command Injection	"/(?:\?|&)(?:host|service|opt|end|start)=[^&]+?\x60.+?\x60/i"
web-application-attack	ET WEB_SPECIFIC_APPS WordPress FSML Plugin fsml-admin.js.php Remote File Inclusion Attempt	"/^\s*(?:(?:ht|f)tps?|data|php)\x3a\//Ri"
web-application-attack	ET WEB_SPECIFIC_APPS Admidio headline parameter Cross Site Scripting Attempt	"/^.+?(?:on(?:(?:s(?:elec|ubmi)|rese)t|d(?:blclick|ragdrop)|(?:mouse|key)[a-z]|c(?:hange|lick)|(?:un)?load|focus|blur)|s(?:cript|tyle=))/Ri"
web-application-attack	ET WEB_SPECIFIC_APPS SonicWALL SonicOS searchStr XML Tag Script Insertion Attempt	"/(?:\x3c|\x253c)dbInfo(?:\x3e|\x253e)[\r\n\s]*?(?:\x3c|\x253c)dbInfoRequest(?:\x3e|\x253e).+?(?:\x3c|\x253c)searchStr(?:\x3e|\x253e)((?!(?:\x3c|\x253c)(?:\/|\x252f)searchStr(?:\x3e|\x253e)).)+?(?:on(?:(?:s(?:elec|ubmi)|rese)t|d(?:blclick|ragdrop)|(?:mouse|key)[a-z]|c(?:hange|lick)|(?:un)?load|focus|blur)|s(?:cript|tyle=)).+?(?:\x3c|\x253c)(?:\/|\x252f)searchStr(?:\x3e|\x253e)/si"
exploit-kit	ET EXPLOIT_KIT Hostile Gate landing seen with pamdql/Sweet Orange base64	"/\.php\?[a-z]=.{2}KAhFXlx9.{2}Oj[^&]+$/"
trojan-activity	ET MALWARE Request for fake postal receipt from e-mail link	"/^\/[A-Z]+\.php\?php=receipt$/"
web-application-attack	ET WEB_SPECIFIC_APPS WHM filtername Parameter Cross Site Scripting Attempt	"/^.+?(?:on(?:(?:s(?:elec|ubmi)|rese)t|d(?:blclick|ragdrop)|(?:mouse|key)[a-z]|c(?:hange|lick)|(?:un)?load|error|focus|blur)|s(?:cript|tyle=))/Ri"
attempted-admin	ET EXPLOIT Possible iOS MobileMail OOB Write/Heap Overflow Exploit Email (Inbound)	"/(?:\x0a|\\n)\/s1Caa6/"
exploit-kit	ET EXPLOIT_KIT Redkit Exploit Kit Three Numerical Character Naming Convention PDF Request	"/\x2F[0-9]{3}\.pdf$/"
exploit-kit	ET EXPLOIT_KIT StyX Landing Page	"/^\d{1,2}=[a-zA-Z0-9+=]{100}/R"
exploit-kit	ET EXPLOIT_KIT Possible Red Dot Exploit Kit Single Character JAR Request	"/^\/[a-z]\.jar$/"
web-application-attack	ET WEB_SPECIFIC_APPS Openconstructor CMS result Parameter Cross Site Scripting Attempt	"/^.+(?:on(?:(?:s(?:elec|ubmi)|rese)t|d(?:blclick|ragdrop)|c(?:hange|lick)|(?:un)?load|focus|mouse|blur|key)|s(?:cript|tyle=))/Ri"
attempted-user	ET WEB_SPECIFIC_APPS Jenkins Script Console Usage (Can be Used to Spawn Shell)	"/^\/?$/R"
command-and-control	ET MALWARE Linux/SSHDoor.A Reporting Backdoor CnC Beacon	"/^[0-9]{1,3}\x2E[0-9]{1,3}\x2E[0-9]{1,3}\x2E[0-9]{1,3}\x3A[0-9]{1,5}/R"
attempted-user	ET WEB_SERVER WSO WebShell Activity POST structure 2	"/name=(?P<q>[\x22\x27])a(?P=q)[^\r\n]*\r\n[\r\n\s]+(?:S(?:e(?:lfRemove|cInfo)|tringTools|afeMode|ql)|(?:Bruteforc|Consol)e|FilesMan|Network|Logout|Php)/i"
web-application-attack	ET WEB_SPECIFIC_APPS Wordpress Audio Player Plugin playerID parameter XSS attempt in swf	"/^.+\)\)\}catch\(.+\)\{/Ri"
web-application-attack	ET WEB_SPECIFIC_APPS Glossword gw_admin.php Cross Site Scripting Attempt	"/a\x3d.+?(?:on(?:(?:s(?:elec|ubmi)|rese)t|d(?:blclick|ragdrop)|(?:mouse|key)[a-z]|c(?:hange|lick)|(?:un)?load|focus|blur)|s(?:cript|tyle=))/i"
command-and-control	ET MALWARE W32/FloatingCloud.Banker CnC Beacon	"/^[a-f0-9]{8}\x2D[a-f0-9]{8}\x2D[a-f0-9]{8}\x2D[a-f0-9]{8}$/Ri"
command-and-control	ET MALWARE Win32/Vundo.OD Checkin	"/^(?:id|key)=/Ri"
command-and-control	ET MALWARE Likseput.B Checkin	"/User-Agent\x3a[^\r\n]+[^\x20]\x3bTrident\/4\.0\x29\s\d{2}\x3a\d{2}\s\r$/mi"
targeted-activity	ET MALWARE Win32/Namsoth.A Checkin/NEWSREELS APT1 Related	"/&userid=\d{4}&other=[MF]/"
targeted-activity	ET MALWARE Win32/Small.XR Checkin 2 WEBC2-CSON APT1 Related	"/^[A-Z]{10}$/R"
command-and-control	ET MALWARE W32/Asprox Passgrub POST CnC Beacon	"/^\x2F[a-f0-9]{40,60}$/i"
attempted-dos	ET WEB_SERVER LOIC Javascript DDoS Inbound	"/\?id=[0-9]{13}&msg=[^&]+$/"
trojan-activity	ET MALWARE RansomCrypt Getting Template	"/\/[a-z0-9]+$/i"
policy-violation	ET POLICY Kindle Fire Browser User-Agent Outbound	"/^\d+\.\d/R"
attempted-user	ET WEB_SERVER Possible Wordpress Super Cache Plugin PHP Injection mfunc	"/(?:%3C%21|\<\!)--[\r\n\s]*?mfunc/i"
attempted-user	ET WEB_SERVER Possible Wordpress Super Cache Plugin PHP Injection mclude	"/(?:%3C%21|\<\!)--[\r\n\s]*?mclude/i"
attempted-user	ET WEB_SERVER Possible Wordpress Super Cache Plugin PHP Injection dynamic-cached-content	"/(?:%3C%21|\<\!)--[\r\n\s]*?dynamic-cached-content/i"
trojan-activity	ET MALWARE FakeAV FakeSmoke HTTP POST check-in	"/^[a-z0-9]{196}/Ri"
attempted-admin	ET WEB_SERVER Possible SQL Injection Attempt char() Danmec related	"/^[0-9]{2,3}\)char\([^\x0d\x0a\x20]{98}/Ri"
trojan-activity	ET MALWARE Linux Backdoor Linux/Cdorked.A Redirect 1	"/^https?\:\/\/[a-f0-9]{16}\.[^\r\n]+?\/index\.php\?[a-z]=(?:[A-Za-z0-9+\/]{4})*(?:[A-Za-z0-9+\/]{2}==|[A-Za-z0-9+\/]{3}=|[A-Za-z0-9+\/]{4})$/i"
command-and-control	ET MALWARE Unknown Checkin	"/\/[a-z]\/$/Ui"
command-and-control	ET MALWARE Lyposit Ransomware Checkin 1	"/^\/ad[^\x2f]*?\/\?[a-z]{1,5}\x3d\x2e?[a-z0-9]+?$/i"
trojan-activity	ET MALWARE Trojan.BlackRev Registration Rev3	"/^[a-z]{15}$/R"
command-and-control	ET MALWARE Possible Win32.Bicololo Checkin	"/^[a-z]{3,4}\/\d{1,4}$/R"
attempted-admin	ET WEB_SERVER Access to /phppath/php Possible Plesk 0-day Exploit June 05 2013	"/^\b/R"
bad-unknown	ET INFO Executable Served From /tmp/ Directory - Malware Hosting Behaviour	"/^\/tmp\/.+\.exe$/"
command-and-control	ET MALWARE KimJongRAT cnc exe pull	"/^subject=(?:[A-Za-z0-9+/]{4})*(?:[A-Za-z0-9+/]{2}==|[A-Za-z0-9+/]{3}=|[A-Za-z0-9+/]{4})_(?:(?:list|que)_done|ini(?:_done)?)&data/"
policy-violation	ET INFO HTTP POST contains pasa= in cleartext	"/^(?!&)./R"
policy-violation	ET INFO HTTP URI contains pasa=	"/(?<=(?:\?|&))pasa=(?!&)./i"
trojan-activity	ET POLICY Android.Plankton/Tonclank Successful Installation Device Information POST	"/(?:(?:command(?:statu)?|bookmark|shortcut)s|h(?:omepage|istory)|eula(?:status)?|installation|activate|dumplog)/i"
trojan-activity	ET USER_AGENTS Unknown - Java Request  - gt 60char hex-ascii	"/[\/\?][a-z0-9]{60,66}[\;0-9]/i"
exploit-kit	ET EXPLOIT_KIT FlimKit hex.zip Java Downloading Jar	"/\/[a-f0-9]+\.zip$/"
exploit-kit	ET EXPLOIT_KIT Java UA Requesting Numeric.ext From Base Dir (Observed in Redkit/Sakura)	"/^\/\d{2,}\.[a-z0-9]+$/i"
trojan-activity	ET WEB_SERVER WebShell Generic - ASP File Uploaded	"/<%[\x00-\x7f]{20}/"
command-and-control	ET MALWARE CBReplay Checkin	"/^\d{1,3}\.\d{1,3}\.\d{1,3}\.\d{1,3}$/"
command-and-control	ET MALWARE CBReplay Checkin	"/^\d+?\x22/R"
command-and-control	ET MALWARE Comfoo Checkin	"/^\/[a-zA-Z0-9\+\/]+={0,2}\/[a-zA-Z0-9\+\/]+={0,2}\d{5}\/\d+\/\d{2}[a-zA-Z0-9\+\/]+={0,2}\/[a-zA-Z0-9\+\/]+={0,2}\d{3}\/$/"
trojan-activity	ET MALWARE Possible Win32/Napolar.A URL Response	"/^[^\r\n]+?\$$/R"
command-and-control	ET MALWARE Trojan.Dirtjump Checkin	"/^[A-Za-z0-9]{15}(?:[A-Za-z0-9]{19})?$/R"
targeted-activity	ET MALWARE Possible APT-12 Related C2	"/=[A-Za-z0-9\/\+]+={0,2}$/"
command-and-control	ET MALWARE W32/Downloader.Mevade.FBV CnC Beacon	"/^[a-f0-9]{32}\/[0-9]$/Ri"
command-and-control	ET MALWARE Hiloti/Mufanom Downloader Checkin	"/\/get\d*\.php\?c=[A-Z]{8}&d=[0-9A-F]{250,}$/"
trojan-activity	ET MALWARE CryptoLocker EXE Download	"/\/crypt_[^\/]*?sell[^\/]*?\d\.exe$/"
trojan-activity	ET MALWARE Kuluoz Activity	"/\/[A-F0-9]+$/"
command-and-control	ET MALWARE Possible W32/Citadel Download From CnC Server Self Referenced /files/ attachment	"/^[^\x22\x2f\r\n]+?\x22\r\n/R"
command-and-control	ET MALWARE W32/Citadel.Arx Variant CnC Beacon 1	"/^[^&]+?&\d+$/R"
exploit-kit	ET EXPLOIT_KIT Possible Magnitude IE EK Payload Nov 8 2013	"/^\/\?[a-f0-9]{32}$/"
exploit-kit	ET EXPLOIT_KIT Safe/CritX/FlashPack URI Struct .php?id=Hex	"/\/(?:java(?:db|im|rh)|silver|flash|msie)\.php\?id=/"
command-and-control	ET MALWARE Vawtrak/NeverQuest Checkin	"/^id=[A-Z0-9]+?&info=[A-Z0-9]+?$/"
attempted-admin	ET WEB_SPECIFIC_APPS Wordpress OptimizePress Arbitratry File Upload	"/^(?:-lncthumb|-sq_button)?\.php/Ri"
trojan-activity	ET MALWARE W32/Liftoh.Downloader Get Final Payload Request	"/^[0-9]{1,3}\x2E[0-9]{1,3}\x2E[0-9]{1,3}\x2E[0-9]{1,3}/R"
command-and-control	ET MALWARE W32/Mevade.Variant CnC POST	"/^\x2F(?:policy|cache)$/"
command-and-control	ET MALWARE W32/Ferret DDOS Bot CnC Beacon 2	"/^(?:ode)?=(?:[A-Za-z0-9+/]{4})*(?:[A-Za-z0-9+/]{2}==|[A-Za-z0-9+/]{3}=|[A-Za-z0-9+/]{4})&h(?:wid)?=/R"
command-and-control	ET MALWARE SpyEye C&C Check-in URI	"/(\?|&)guid=[^!&]+?\!/"
command-and-control	ET MOBILE_MALWARE Android/HeHe.Spy ReportMessageRequest CnC Beacon	"/^\d{1,3}\.\d{1,3}\.\d{1,3}\.\d{1,3}/"
web-application-attack	ET WEB_SERVER Possible Oracle Reports Forms RCE CVE-2012-3152	"/^\s*?=\s*?[\x22\x27]?(?:f(?:ile|tp)|gopher|https?|mailto)\s*?\x3a/Ri"
trojan-activity	ET MALWARE DirtJumper Activity	"/^\d+?=\d+?(?:&ver=\d+?)?&req=\d+?(?:&r=)?$/"
command-and-control	ET MALWARE Infostealer.Jackpos Checkin	"/^mac=(?:[A-F0-9]{2}-){5}[A-F0-9]{2}&t1=/"
attempted-admin	ET WEB_SPECIFIC_APPS MediaWiki thumb.php RCE	"/[&?](?:(?:p|%[57]0)(?:(?:a|%[46]1)(?:g|%[46]7)(?:e|%[46]5))?|(?:w|%[57]7)(?:(?:i|%[46]9)(?:d|%[64]4)(?:t|%[57]4)(?:h|%[64]8))?)(?:\s|%20)*?(?:%3d|=)(?:\s|%20)*?(?:\d|%3[0-9])+?(?:\x3b|%3[bB]|%26)/Ii"
attempted-admin	ET WEB_SPECIFIC_APPS MediaWiki thumb.php RCE	"/[&?](?:w(?:idth)|p(?:age))=\d+\s*?[\x3b&]/i"
attempted-admin	ET WEB_SPECIFIC_APPS MediaWiki thumb.php RCE	"/[&?]f=/i"
command-and-control	ET MALWARE Kazy/Kryptor/Cycbot Trojan Checkin 2	"/\.(?:(?:jp|pn)g|cgi|gif)\?tq=/"
command-and-control	ET MALWARE W32/Qakbot.Bot Version 8 CnC Beacon	"/^\/[b-u][A-Za-z0-9]{6,25}\.php$/"
denial-of-service	ET DOS Inbound GoldenEye DoS attack	"/^\/\?[a-zA-Z0-9]{3,10}=[a-zA-Z0-9]{3,20}(?:&[a-zA-Z0-9]{3,10}=[a-zA-Z0-9]{3,20})*?$/"
denial-of-service	ET DOS Inbound GoldenEye DoS attack	"/^Cache-Control\x3a\x20(?:max-age=0|no-cache)\r?$/m"
trojan-activity	ET MALWARE Possible Kelihos Infection Executable Download With Malformed Header	"/^Last-Modified\x3a(?:\s[^\r\n]{2}|[^\r\n\s]{3}),/m"
command-and-control	ET MALWARE W32/PointOfSales.Misc CnC Activity	"/^\d{5,}$/R"
attempted-user	ET MALWARE Possible Linux/Cdorked.A Incoming Command	"/\?[0-9a-f]{6}$/"
targeted-activity	ET MALWARE WEBC2-CSON Checkin - APT1 Related	"/\?ID=[A-Z]{10}$/"
trojan-activity	ET MALWARE Virut Family GET	"/^[0-9A-F]{12,24}/Ri"
exploit-kit	ET EXPLOIT_KIT DRIVEBY Nuclear EK Landing May 05 2014	"/^[a-f0-9]{6}\x22>\r\n(?:<(?P<tag>[^>]{1,10})>[A-Za-z0-9]+?<\/(?P=tag)>\r\n){0,10}\r\n<script>(?:var [a-zA-Z0-9]{1,20}\x3b){1,20}[a-zA-Z0-9]{1,20}\s*?=/R"
command-and-control	ET MALWARE W32/Asprox php.dll.crp POST CnC Beacon	"/\x3a\d{1,5}$/"
command-and-control	ET MALWARE Win32/Rodecap CnC Checkin	"/\.cgi\?s(?:id)?=\d{1,12}&r=/"
command-and-control	ET MALWARE Win32/Urausy.C Checkin 4	"/\/(?:[^\x2f]+?\/)?[a-z-_]+?\.(?:php|html)$/i"
trojan-activity	ET MALWARE EtumBot Registration Request	"/^\x2fimage\x2f[A-Za-z0-9\+_-]+\.jpg$/i"
command-and-control	ET MALWARE Hangover related campaign Checkin	"/\/\/?$/"
trojan-activity	ET MALWARE HTTP Request to a *.su domain with direct request/fakebrowser (multiple families flowbit set)	"/^(?:\x3a\d{1,5})?$/Ri"
trojan-activity	ET MALWARE HTTP Request to a *.pw domain with direct request/fake browser (multiple families flowbit set)	"/^(?:\x3a\d{1,5})?$/i"
command-and-control	ET MALWARE W32/Asprox.Bot Knock Variant CnC Beacon	"/^\x2F[A-F0-9]{20,}+$/"
command-and-control	ET MALWARE W32/Asprox.Bot Knock Variant CnC Beacon	"/^\d{1,3}\.\d{1,3}\.\d{1,3}\.\d{1,3}(?:\x3a\d{1,5})$/i"
web-application-attack	ET WEB_SPECIFIC_APPS Oracle Event Processing FileUploadServlet Arbitrary File Upload	"/^\s*?=\s*?[\x22\x27]?[^&]*?(?:%(?:25)?2e(?:%(?:(?:25)?2e(?:%(?:25)?5c|\/|\\)|2e(?:25)?%(?:25)?2f)|\.(?:%(?:25)?(?:2f|5c)|\/|\\))|\.(?:%(?:25)?2e(?:%(?:25)?(?:2f|5c)|\/|\\)|\.(?:%(?:25)?(?:2f|5c)|\/|\\)))/Ri"
targeted-activity	ET MALWARE Rhabdo CnC Activity M2	"/^[A-Za-z0-9]{48}\x3a(?:[A-Za-z0-9/+]{4})*(?:[A-Za-z0-9/+]{2}==|[A-Za-z0-9/+]{3}=|[A-Za-z0-9/+]{4})$/R"
trojan-activity	ET MALWARE Upatre Common URI Struct July 15 2014	"/\/0\/$/"
attempted-user	ET WEB_SERVER Adobe Flash Player Rosetta Flash compressed CWS in URI	"/^[a-z0-9\.\_]{5}hC[a-z0-9\.\_]{50}/Ri"
exploit-kit	ET EXPLOIT_KIT Fiesta EK randomized javascript Gate Jul 18 2014	"/^\/[A-Za-z0-9]{6,16}\.js\?[a-zA-Z0-9]{7,32}=(?![0-9]+$)[a-f0-9]{5,30}$/U"
exploit-kit	ET EXPLOIT_KIT Fiesta EK randomized javascript Gate Jul 18 2014	"/^Host\x3a\x20[^\.\r\n]+?\.[a-z]{2,4}\r\n/mi"
bad-unknown	ET INFO SUSPICIOUS Java Request to NOIP Dynamic DNS Domain	"/\.(?:s(?:e(?:rve(?:(?:(?:(?:counterstri|qua)k|exchang|gam)e|h(?:alflife|umour|ttp)|p(?:ics|2p)|sarcasm|ftp)\.com|m(?:inecraft\.net|p3\.com)|b(?:eer\.com|log\.net))|curity(?:exploit|tactic)s\.com)|tufftoread\.com|ytes\.net)|m(?:y(?:(?:(?:dissen|effec)t|mediapc|psx)\.net|securitycamera\.(?:com|net|org)|(?:activedirectory|vnc)\.com|ftp\.(?:biz|org))|lbfan\.org|mafan\.biz)|d(?:(?:itchyourip|amnserver|ynns)\.com|dns(?:\.(?:net|me)|king\.com)|ns(?:iskinky\.com|for\.me)|vrcam\.info)|n(?:o(?:-ip\.(?:c(?:o\.uk|a)|info|biz|net|org)|ip\.(?:me|us))|et-freaks\.com|flfan\.org|hlfan\.net)|h(?:o(?:mesecurity(?:ma|p)c\.com|pto\.(?:org|me))|ealth-carereform\.com)|p(?:(?:rivatizehealthinsurance|gafan)\.net|oint(?:2this\.com|to\.us))|c(?:(?:o(?:uchpotatofries|llegefan)|able-modem)\.org|iscofreak\.com)|g(?:o(?:lffan\.us|tdns\.ch)|eekgalaxy\.com)|b(?:logsyte\.com|ounceme\.net|rasilia\.me)|re(?:ad-books\.org|directme\.net)|u(?:nusualperson\.com|fcfan\.org)|w(?:orkisboring\.com|ebhop\.me)|(?:3utiliti|quicksyt)es\.com|eating-organic\.net|ilovecollege\.info|fantasyleague\.cc|loginto\.me|zapto\.org)(?:\x3a\d{1,5})?$/"
bad-unknown	ET INFO SUSPICIOUS Java Request to ChangeIP Dynamic DNS Domain	"/\.(?:m(?:y(?:p(?:op3\.(?:net|org)|icture\.info)|n(?:etav\.(?:net|org)|umber\.org)|(?:secondarydns|lftv|03)\.com|d(?:ad\.info|dns\.com)|ftp\.(?:info|name)|(?:mom|z)\.info|www\.biz)|(?:r(?:b(?:asic|onus)|(?:slov|fac)e)|efound)\.com|oneyhome\.biz)|d(?:yn(?:amicdns\.(?:(?:org|co|me)\.uk|biz)|dns\.pro|ssl\.com)|ns(?:(?:-(?:stuff|dns)|0[45]|et|rd)\.com|[12]\.us)|dns\.(?:m(?:e\.uk|obi|s)|info|name|us)|(?:smtp|umb1)\.com|hcp\.biz)|(?:j(?:u(?:ngleheart|stdied)|etos|kub)|y(?:ou(?:dontcare|rtrap)|gto)|4(?:mydomain|dq|pu)|q(?:high|poe)|2(?:waky|5u)|z(?:yns|zux)|vizvaz|1dumb)\.com|s(?:e(?:(?:llclassics|rveusers?|ndsmtp)\.com|x(?:idude\.com|xxy\.biz))|quirly\.info|sl443\.org|ixth\.biz)|o(?:n(?:mypc\.(?:info|biz|net|org|us)|edumb\.com)|(?:(?:urhobb|cr)y|rganiccrap|tzo)\.com)|f(?:ree(?:(?:ddns|tcp)\.com|www\.(?:info|biz))|a(?:qserv|rtit)\.com|tp(?:server|1)\.biz)|a(?:(?:(?:lmostm|cmeto)y|mericanunfinished)\.com|uthorizeddns\.(?:net|org|us))|n(?:s(?:0(?:1\.(?:info|biz|us)|2\.(?:info|biz|us))|[123]\.name)|inth\.biz)|c(?:hangeip\.(?:n(?:ame|et)|org)|leansite\.(?:info|biz|us)|ompress\.to)|i(?:(?:t(?:emdb|saol)|nstanthq|sasecret|kwb)\.com|ownyour\.(?:biz|org))|g(?:r8(?:domain|name)\.biz|ettrials\.com|ot-game\.org)|l(?:flink(?:up\.(?:com|net|org)|\.com)|ongmusic\.com)|t(?:o(?:ythieves\.com|h\.info)|rickip\.(?:net|org))|(?:undefineddynamic-dns|rebatesrule|3-a)\.net|x(?:x(?:xy\.(?:info|biz)|uz\.com)|24hr\.com)|p(?:canywhere\.net|roxydns\.com|ort25\.biz)|w(?:ww(?:host|1)\.biz|ikaba\.com|ha\.la)|e(?:(?:smtp|dns)\.biz|zua\.com|pac\.to)|https443\.(?:net|org)|bigmoney\.biz)(?:\x3a\d{1,5})?$/"
bad-unknown	ET INFO SUSPICIOUS Java Request to Afraid.org Top 100 Dynamic DNS Domain	"/\.(?:s(?:tr(?:eetdirectory\.co\.id|angled\.net)|(?:at(?:dv\.net|-dv)|vlen)\.ru(?:pacetechnology\.ne|oon\.i)t|hop\.tm|uka\.se)|c(?:(?:hickenkiller|rabdance)\.com|o(?:ntinent\.kz|alnet\.ru)|sproject\.org|c\.st|f\.gs)|m(?:i(?:ne(?:craftn(?:ation\.net|oob\.com)|\.bz)|l\.nf)|ooo\.(?:info|com)|adhacker\.biz)|t(?:h(?:emafia\.info|cgirls\.com)|wilightparadox\.com|ime4film\.ru|ruecsi\.org|28\.net)|a(?:(?:(?:vangardkennel|gropeople)\.r|buser\.e)u|ntongorbunov\.com|llowed\.org|x\.lt)|h(?:a(?:ck(?:quest\.com|ed\.jp)|ppyforever\.com)|ome(?:net\.or|\.k)g|-o-s-t\.name)|p(?:(?:rivatedns|sybnc|ort0|wnz)\.org|(?:hoto-frame|irat3)\.com|unked\.us)|i(?:n(?:fo\.(?:gf|tm)|c\.gs)|gnorelist\.com|iiii\.info|z\.rs)|b(?:i(?:gbox\.info|z\.tm)|yte4byte\.com|ot\.nu|rb\.dj)|d(?:earabba\.org|-n-s\.name|alnet\.ca|ynet\.com)|(?:w(?:ith-linux|hynotad)|3dxtras|ohbah)\.com|u(?:n(?:do\.it|i\.cx)|k\.(?:is|to)|s\.to)|v(?:(?:erymad\.ne|r\.l)t|ietnam\.ro)|r(?:o(?:ot\.sx|\.lt)|-o-o-t\.net)|n(?:eon\.org|ow\.im|a\.tl|x\.tc)|j(?:umpingcrab\.com|avafaq\.nu)|f(?:(?:art|ram)ed\.net|tp\.sh)|(?:k(?:ir22\.r|\.v)|69\.m)u|l(?:inux[dx]\.org|eet\.la)|e(?:vils\.in|z\.lv)|(?:24-7\.r|qc\.t)o|(?:55|gw)\.lt|1337\.cx)(?:\x3a\d{1,5})?$/"
attempted-admin	ET EXPLOIT Possible iOS MobileMail OOB Write/Heap Overflow Exploit Email (Inbound)	"/^(?:\\r\\n|\x0d\x0a)AABI/R"
attempted-admin	ET EXPLOIT Possible iOS MobileMail OOB Write/Heap Overflow Exploit Email (Inbound)	"/^(?:\\r\\n|\x0d\x0a)C/R"
trojan-activity	ET MALWARE Win32/TrojanDownloader.Waski.F Locker DL URI Struct Jul 25 2014	"/^[^\x2f]+\/[a-z0-9]+$/R"
trojan-activity	ET MALWARE Win32/Gatak Activity	"/\/(?:[a-z]{4,9}\/[a-z]{3,10}\?[a-z_]{2,9}=[0-9]{2,8}|[a-z]{10})&[a-z]{5,9}=[a-zA-Z0-9_*]{30,}$/"
command-and-control	ET MALWARE BITTERBUG Checkin	"/^[^\\\*\+\=\|\:\;\x22\?\<\>\,\#][a-zA-Z0-9-!@#\$%^&\(\)\x20_{}\.~]{1,14}_/R"
trojan-activity	ET MALWARE Lurk Downloader Check-in	"/^\/lolo\/[0-9]+\/[0-9]+\/[0-9]+\/[0-9]+\.html$/"
trojan-activity	ET MALWARE Lurk Click fraud Template Request	"/^\/log\/[0-9]+\/[0-9]+\/\?id=[0-9]+$/"
command-and-control	ET MALWARE Dridex/Bugat/Feodo POST Checkin	"/^\d{1,3}\.\d{1,3}\.\d{1,3}\.\d{1,3}(?:\x3a\d{1,5})?$/"
command-and-control	ET MALWARE Dridex/Bugat/Feodo POST Checkin	"/^\/[\/a-z0-9]+$/i"
command-and-control	ET MALWARE HighTide trojan Checkin	"/^\/\?\d(?:[A-Za-z0-9~_]{4})*(?:[A-Za-z0-9~_]{2}--|[A-Za-z0-9~_]{3}-|[A-Za-z0-9~_]{4})$/"
targeted-activity	ET MALWARE W32/Threebyte.APT Checkin	"/^\/UID\d+\.jsp\?/"
attempted-recon	ET EXPLOIT NEC SL2100 - Session Enumeration Attempt	"/^\d{3}/R"
attempted-admin	ET EXPLOIT BlogEngine 3.3 - syndication.axd XXE Injection Attempt	"/^(?:https?:\/\/|(\d{1,3}\.){3}\d{1,3}|([a-z0-9-]+\.)+[a-z]{1,8})/Ri"
attempted-admin	ET EXPLOIT Possible MPC Sharj 3.11.1 - Arbitrary File Download Attempt	"/^(?:==[A-Z0-9+/]{2}|=[A-Z0-9+/]{3}|[A-Z0-9+/]{4})(?:[A-Z0-9+/]{4})*$/Ri"
command-and-control	ET MALWARE JsOutProx Variant CnC Activity	"/^[a-z]+=(?:[A-Za-z0-9+/]{4})*(?:[A-Za-z0-9+/]{2}==|[A-Za-z0-9+/]{3}=|[A-Za-z0-9+/]{4})+$/"
command-and-control	ET MALWARE JsOutProx Variant CnC Activity	"/^(?:[A-Za-z0-9+/]{4})*(?:[A-Za-z0-9+/]{2}==|[A-Za-z0-9+/]{3}=|[A-Za-z0-9+/]{4})+$/"
attempted-dos	ET DOS LOIC Javascript DDoS Outbound	"/^\/\?id=[0-9]{13}&msg=/"
web-application-attack	ET DOS LOIC POST	"/^13\d{11}/"
trojan-activity	ET MALWARE Rogue AV Downloader concat URI	"/\.php\?id=[a-zA-Z]{15,}&?x=\d+&?os=[0-9.]+&?n=\d/"
command-and-control	ET MALWARE Ponmocup C2 Post-infection Checkin	"/^[0-9A-F]{550,}\.html/Ri"
trojan-activity	ET MALWARE Suspicious Download Setup_ exe	"/\/Setup_\d+\.exe$/i"
command-and-control	ET MALWARE Potential FakePAV Checkin	"/\?0=.*\&1=.*\&2=.*\&3=.*\&4=.*\&5=.*\&6=.*\&7=.*\&8=/i"
command-and-control	ET MALWARE EVILNUM CnC Connectivity Check	"/&ver=\d\.\d$/i"
trojan-activity	ET MALWARE Kuluoz/Asprox Activity	"/^\/(?:[A-Fa-f0-9]+|index\.php)$/"
web-application-attack	ET MALWARE BroBot POST	"/^(?:c(?:omment|_id)|m(?:jdu)?)=/"
trojan-activity	ET MALWARE Probable OneLouder downloader (Zeus P2P)	"/^\/1+$/"
trojan-activity	ET MALWARE Vawtrak/NeverQuest Posting Data	"/\/0[0-2]\/.+?\/[a-f0-9]+\?id=[a-f0-9]+$/i"
trojan-activity	ET MALWARE Vawtrak/NeverQuest Posting Data	"/(?:MSIE|rv\x3a11)/i"
social-engineering	ET PHISHING French Government COVID-19 Landing Page	"/^(?:(?!\.php).+)\.php\x22/R"
command-and-control	ET MALWARE Possible Win32/Qbot/Quakbot Checkin via HTTP GET	"/\/\d+\.png\?uid=(?:[A-Za-z0-9+/]{4})*(?:[A-Za-z0-9+/]{2}==|[A-Za-z0-9+/]{3}=|[A-Za-z0-9+/]{4})+$/"
command-and-control	ET MALWARE Taurus Stealer CnC Host Checkin	"/&data=(?:[a-z]\d){7,}$/"
command-and-control	ET MALWARE Taurus Stealer CnC Exfil	"/&data=(?:[A-Za-z0-9+/]{4})*(?:[A-Za-z0-9+/]{2}==|[A-Za-z0-9+/]{3}=|[A-Za-z0-9+/]{4})+$/"
command-and-control	ET MALWARE Taurus Stealer CnC Exfil	"/^(?:[a-z]\d){7,}\.zip\x22/R"
trojan-activity	ET MALWARE Cryptowall 2.0 DL URI Struct Oct 2 2014	"/^[a-z0-9]+\x20HTTP/R"
trojan-activity	ET MALWARE Cryptowall 2.0 DL URI Struct Oct 2 2014	"/(?:MSIE|rv\x3a11\.0)/"
trojan-activity	ET MALWARE Win32/PSW.Papras.CK file upload	"/^\x2f[a-zA-Z]{4,}\x2ephp\x3f[a-zA-Z]{2,10}\x3d(?:[A-Za-z0-9+/]{2}==|[A-Za-z0-9+/]{3}=|[A-Za-z0-9+/]{4})+/"
command-and-control	ET MALWARE Dridex/Bugat/Feodo GET Checkin	"/^\d{1,3}\.\d{1,3}\.\d{1,3}\.\d{1,3}(?:\x3a\d{1,5})$/"
trojan-activity	ET MALWARE Vawtrak/NeverQuest Posting Data	"/=0[0-2](?:&\w+=[a-fA-F0-9]{8}){2}&\w+=[a-fA-F0-9]+$/"
trojan-activity	ET MALWARE Vawtrak/NeverQuest Posting Data	"/0[0-2]0000[a-fA-F0-9]{16,}$/"
web-application-attack	ET WEB_SPECIFIC_APPS BASE base_stat_common.php remote file include	"/^(?:(?:ht|f)tps?|data|php)/Ri"
targeted-activity	ET MALWARE Win32/Chopstick Checkin (APT28 Related)	"/^(?:[A-Za-z0-9_-]{4})*(?:[A-Za-z0-9_-]{2}==|[A-Za-z0-9_-]{3}=|[A-Za-z0-9_-]{4})+/R"
targeted-activity	ET MALWARE Win32/Coreshell Checkin (APT28 Related)	"/^(?:[A-Za-z0-9+/]{4})*(?:[A-Za-z0-9+/]{2}==|[A-Za-z0-9+/]{3}=|[A-Za-z0-9+/]{4})+?$/R"
exploit-kit	ET EXPLOIT_KIT Fiesta Flash Exploit URI Struct	"/\/\??[a-f0-9]{60,}\x3b1\d{5}\x3b\d{1,3}$/"
exploit-kit	ET EXPLOIT_KIT Fiesta SilverLight 5.x Exploit URI Struct	"/\/\??[a-f0-9]{60,}\x3b5[0-1]\d{5}$/"
